### ISSUE TITLE
С&С Server Segmentation fault 

### ISSUE THREAD

**Issue by mamkinminer** [Bendr0id/xmrigCC#41]
Server crashes randomly with error: Segmentation fault (core dumped)
Very unstable...
I connect about 80 miners

**Comment by Bendr0id** [comment]
Can't be a general problem. Works for people with much more miners without a problem.

Some more information would be helpful. Like os, hardware, logs etc.



Am 16.02.2018 18:42 schrieb mamkinminer <notifications@github.com>:

Server crashes randomly with error: Segmentation fault (core dumped)
Very unstable...
I connect about 80 miners

**Comment by mamkinminer** [comment]
Linux  4.4.0-87-generic #110-Ubuntu SMP Tue Jul 18 12:55:35 UTC 2017 x86_64 x86_64 x86_64 GNU/Linux ( Ubuntu 16.04 )

Vmware virtual machine:
CPU  Intel(R) Xeon(R) CPU  X5670 
RAM 4Gb

Log:

[2018-02-16 08:52:17] Status from client: WS0018-01
[2018-02-16 08:52:17] Status from client: WS0018-01
Aborted (core dumped)

tcpdump :

08:52:17.356253 IP XX.XX.162.199.55755 > XX.XX.226.245.80: Flags [.], ack 1, win 256, length 0
08:52:17.357046 IP XX.XX.162.199.55755 > XX.XX.226.245.80: Flags [P.], seq 1:980, ack 1, win 256, length 979: HTTP: POST /client/setClientStatus?clientId=WS0018-01 HTTP/1.0
08:52:17.357065 IP XX.XX.226.245.80 > XX.XX.162.199.55755: Flags [.], ack 980, win 244, length 0
08:52:17.358637 IP XX.XX.162.199.53897 > XX.XX.226.245.80: Flags [.], ack 360, win 255, length 0
08:52:17.359053 IP XX.XX.162.199.53897 > XX.XX.226.245.80: Flags [F.], seq 980, ack 360, win 255, length 0
08:52:17.359077 IP XX.XX.226.245.80 > XX.XX.162.199.53897: Flags [.], ack 981, win 244, length 0
08:52:17.509355 IP XX.XX.162.199.54336 > XX.XX.226.245.80: Flags [S], seq 2870558815, win 8192, options [mss 1460,nop,wscale 8,nop,nop,sackOK], length 0
08:52:17.509388 IP XX.XX.226.245.80 > XX.XX.162.199.54336: Flags [S.], seq 1904499306, ack 2870558816, win 29200, options [mss 1460,nop,nop,sackOK,nop,wscale 7], length 0
08:52:17.512904 IP XX.XX.162.199.54336 > XX.XX.226.245.80: Flags [.], ack 1, win 256, length 0
08:52:17.512981 IP XX.XX.162.199.54336 > XX.XX.226.245.80: Flags [P.], seq 1:59, ack 1, win 256, length 58: HTTP: POST /client/setClientStatus?clientId=computer1 HTTP/1.0
08:52:17.512993 IP XX.XX.226.245.80 > XX.XX.162.199.54336: Flags [.], ack 59, win 229, length 0
08:52:17.516913 IP XX.XX.162.199.54336 > XX.XX.226.245.80: Flags [P.], seq 59:979, ack 1, win 256, length 920: HTTP
08:52:17.516927 IP XX.XX.226.245.80 > XX.XX.162.199.54336: Flags [.], ack 979, win 243, length 0
08:52:17.549842 IP XX.XX.226.245.80 > XX.XX.162.199.55755: Flags [F.], seq 1, ack 980, win 244, length 0
08:52:17.549868 IP XX.XX.226.245.80 > XX.XX.162.199.54336: Flags [R.], seq 1, ack 979, win 243, length 0
08:52:17.553687 IP XX.XX.162.199.55755 > XX.XX.226.245.80: Flags [.], ack 2, win 256, length 0
08:52:17.553727 IP XX.XX.162.199.55755 > XX.XX.226.245.80: Flags [F.], seq 980, ack 2, win 256, length 0

**Comment by mamkinminer** [comment]
And strace output:

execve("./xmrigCCServer", ["./xmrigCCServer"], [/* 20 vars */]) = 0
brk(NULL)                               = 0x14dc000
access("/etc/ld.so.nohwcap", F_OK)      = -1 ENOENT (No such file or directory)
access("/etc/ld.so.preload", R_OK)      = -1 ENOENT (No such file or directory)
open("/etc/ld.so.cache", O_RDONLY|O_CLOEXEC) = 3
fstat(3, {st_mode=S_IFREG|0644, st_size=26155, ...}) = 0
mmap(NULL, 26155, PROT_READ, MAP_PRIVATE, 3, 0) = 0x7f1a233c9000
close(3)                                = 0
access("/etc/ld.so.nohwcap", F_OK)      = -1 ENOENT (No such file or directory)
open("/usr/lib/x86_64-linux-gnu/libuv.so.1", O_RDONLY|O_CLOEXEC) = 3
read(3, "\177ELF\2\1\1\0\0\0\0\0\0\0\0\0\3\0>\0\1\0\0\0@a\0\0\0\0\0\0"..., 832) = 832
fstat(3, {st_mode=S_IFREG|0644, st_size=142640, ...}) = 0
mmap(NULL, 4096, PROT_READ|PROT_WRITE, MAP_PRIVATE|MAP_ANONYMOUS, -1, 0) = 0x7f1a233c8000
mmap(NULL, 2239336, PROT_READ|PROT_EXEC, MAP_PRIVATE|MAP_DENYWRITE, 3, 0) = 0x7f1a22f88000
mprotect(0x7f1a22faa000, 2093056, PROT_NONE) = 0
mmap(0x7f1a231a9000, 8192, PROT_READ|PROT_WRITE, MAP_PRIVATE|MAP_FIXED|MAP_DENYWRITE, 3, 0x21000) = 0x7f1a231a9000
close(3)                                = 0
access("/etc/ld.so.nohwcap", F_OK)      = -1 ENOENT (No such file or directory)
open("/usr/lib/x86_64-linux-gnu/libmicrohttpd.so.10", O_RDONLY|O_CLOEXEC) = 3
read(3, "\177ELF\2\1\1\0\0\0\0\0\0\0\0\0\3\0>\0\1\0\0\0\200;\0\0\0\0\0\0"..., 832) = 832
fstat(3, {st_mode=S_IFREG|0644, st_size=97232, ...}) = 0
mmap(NULL, 2192344, PROT_READ|PROT_EXEC, MAP_PRIVATE|MAP_DENYWRITE, 3, 0) = 0x7f1a22d70000
mprotect(0x7f1a22d87000, 2093056, PROT_NONE) = 0
mmap(0x7f1a22f86000, 8192, PROT_READ|PROT_WRITE, MAP_PRIVATE|MAP_FIXED|MAP_DENYWRITE, 3, 0x16000) = 0x7f1a22f86000
close(3)                                = 0
access("/etc/ld.so.nohwcap", F_OK)      = -1 ENOENT (No such file or directory)
open("/lib/x86_64-linux-gnu/libpthread.so.0", O_RDONLY|O_CLOEXEC) = 3
read(3, "\177ELF\2\1\1\0\0\0\0\0\0\0\0\0\3\0>\0\1\0\0\0\260`\0\0\0\0\0\0"..., 832) = 832
fstat(3, {st_mode=S_IFREG|0755, st_size=138696, ...}) = 0
mmap(NULL, 2212904, PROT_READ|PROT_EXEC, MAP_PRIVATE|MAP_DENYWRITE, 3, 0) = 0x7f1a22b53000
mprotect(0x7f1a22b6b000, 2093056, PROT_NONE) = 0
mmap(0x7f1a22d6a000, 8192, PROT_READ|PROT_WRITE, MAP_PRIVATE|MAP_FIXED|MAP_DENYWRITE, 3, 0x17000) = 0x7f1a22d6a000
mmap(0x7f1a22d6c000, 13352, PROT_READ|PROT_WRITE, MAP_PRIVATE|MAP_FIXED|MAP_ANONYMOUS, -1, 0) = 0x7f1a22d6c000
close(3)                                = 0
access("/etc/ld.so.nohwcap", F_OK)      = -1 ENOENT (No such file or directory)
open("/lib/x86_64-linux-gnu/libc.so.6", O_RDONLY|O_CLOEXEC) = 3
read(3, "\177ELF\2\1\1\3\0\0\0\0\0\0\0\0\3\0>\0\1\0\0\0P\t\2\0\0\0\0\0"..., 832) = 832
fstat(3, {st_mode=S_IFREG|0755, st_size=1868984, ...}) = 0
mmap(NULL, 4096, PROT_READ|PROT_WRITE, MAP_PRIVATE|MAP_ANONYMOUS, -1, 0) = 0x7f1a233c7000
mmap(NULL, 3971488, PROT_READ|PROT_EXEC, MAP_PRIVATE|MAP_DENYWRITE, 3, 0) = 0x7f1a22789000
mprotect(0x7f1a22949000, 2097152, PROT_NONE) = 0
mmap(0x7f1a22b49000, 24576, PROT_READ|PROT_WRITE, MAP_PRIVATE|MAP_FIXED|MAP_DENYWRITE, 3, 0x1c0000) = 0x7f1a22b49000
mmap(0x7f1a22b4f000, 14752, PROT_READ|PROT_WRITE, MAP_PRIVATE|MAP_FIXED|MAP_ANONYMOUS, -1, 0) = 0x7f1a22b4f000
close(3)                                = 0
access("/etc/ld.so.nohwcap", F_OK)      = -1 ENOENT (No such file or directory)
open("/lib/x86_64-linux-gnu/librt.so.1", O_RDONLY|O_CLOEXEC) = 3
read(3, "\177ELF\2\1\1\0\0\0\0\0\0\0\0\0\3\0>\0\1\0\0\0\0!\0\0\0\0\0\0"..., 832) = 832
fstat(3, {st_mode=S_IFREG|0644, st_size=31712, ...}) = 0
mmap(NULL, 2128832, PROT_READ|PROT_EXEC, MAP_PRIVATE|MAP_DENYWRITE, 3, 0) = 0x7f1a22581000
mprotect(0x7f1a22588000, 2093056, PROT_NONE) = 0
mmap(0x7f1a22787000, 8192, PROT_READ|PROT_WRITE, MAP_PRIVATE|MAP_FIXED|MAP_DENYWRITE, 3, 0x6000) = 0x7f1a22787000
close(3)                                = 0
access("/etc/ld.so.nohwcap", F_OK)      = -1 ENOENT (No such file or directory)
open("/lib/x86_64-linux-gnu/libdl.so.2", O_RDONLY|O_CLOEXEC) = 3
read(3, "\177ELF\2\1\1\0\0\0\0\0\0\0\0\0\3\0>\0\1\0\0\0\240\r\0\0\0\0\0\0"..., 832) = 832
fstat(3, {st_mode=S_IFREG|0644, st_size=14608, ...}) = 0
mmap(NULL, 2109680, PROT_READ|PROT_EXEC, MAP_PRIVATE|MAP_DENYWRITE, 3, 0) = 0x7f1a2237d000
mprotect(0x7f1a22380000, 2093056, PROT_NONE) = 0
mmap(0x7f1a2257f000, 8192, PROT_READ|PROT_WRITE, MAP_PRIVATE|MAP_FIXED|MAP_DENYWRITE, 3, 0x2000) = 0x7f1a2257f000
close(3)                                = 0
access("/etc/ld.so.nohwcap", F_OK)      = -1 ENOENT (No such file or directory)
open("/usr/lib/x86_64-linux-gnu/libgnutls.so.30", O_RDONLY|O_CLOEXEC) = 3
read(3, "\177ELF\2\1\1\0\0\0\0\0\0\0\0\0\3\0>\0\1\0\0\0\300R\2\0\0\0\0\0"..., 832) = 832
fstat(3, {st_mode=S_IFREG|0644, st_size=1239440, ...}) = 0
mmap(NULL, 4096, PROT_READ|PROT_WRITE, MAP_PRIVATE|MAP_ANONYMOUS, -1, 0) = 0x7f1a233c6000
mmap(NULL, 3338624, PROT_READ|PROT_EXEC, MAP_PRIVATE|MAP_DENYWRITE, 3, 0) = 0x7f1a2204d000
mprotect(0x7f1a22170000, 2093056, PROT_NONE) = 0
mmap(0x7f1a2236f000, 53248, PROT_READ|PROT_WRITE, MAP_PRIVATE|MAP_FIXED|MAP_DENYWRITE, 3, 0x122000) = 0x7f1a2236f000
mmap(0x7f1a2237c000, 384, PROT_READ|PROT_WRITE, MAP_PRIVATE|MAP_FIXED|MAP_ANONYMOUS, -1, 0) = 0x7f1a2237c000
close(3)                                = 0
access("/etc/ld.so.nohwcap", F_OK)      = -1 ENOENT (No such file or directory)
open("/lib/x86_64-linux-gnu/libgcrypt.so.20", O_RDONLY|O_CLOEXEC) = 3
read(3, "\177ELF\2\1\1\0\0\0\0\0\0\0\0\0\3\0>\0\1\0\0\0\0\215\0\0\0\0\0\0"..., 832) = 832
fstat(3, {st_mode=S_IFREG|0644, st_size=919168, ...}) = 0
mmap(NULL, 3015360, PROT_READ|PROT_EXEC, MAP_PRIVATE|MAP_DENYWRITE, 3, 0) = 0x7f1a21d6c000
mprotect(0x7f1a21e44000, 2093056, PROT_NONE) = 0
mmap(0x7f1a22043000, 36864, PROT_READ|PROT_WRITE, MAP_PRIVATE|MAP_FIXED|MAP_DENYWRITE, 3, 0xd7000) = 0x7f1a22043000
mmap(0x7f1a2204c000, 704, PROT_READ|PROT_WRITE, MAP_PRIVATE|MAP_FIXED|MAP_ANONYMOUS, -1, 0) = 0x7f1a2204c000
close(3)                                = 0
access("/etc/ld.so.nohwcap", F_OK)      = -1 ENOENT (No such file or directory)
open("/lib/x86_64-linux-gnu/libz.so.1", O_RDONLY|O_CLOEXEC) = 3
read(3, "\177ELF\2\1\1\0\0\0\0\0\0\0\0\0\3\0>\0\1\0\0\0\260\35\0\0\0\0\0\0"..., 832) = 832
fstat(3, {st_mode=S_IFREG|0644, st_size=104864, ...}) = 0
mmap(NULL, 2199848, PROT_READ|PROT_EXEC, MAP_PRIVATE|MAP_DENYWRITE, 3, 0) = 0x7f1a21b52000
mprotect(0x7f1a21b6b000, 2093056, PROT_NONE) = 0
mmap(0x7f1a21d6a000, 8192, PROT_READ|PROT_WRITE, MAP_PRIVATE|MAP_FIXED|MAP_DENYWRITE, 3, 0x18000) = 0x7f1a21d6a000
close(3)                                = 0
access("/etc/ld.so.nohwcap", F_OK)      = -1 ENOENT (No such file or directory)
open("/usr/lib/x86_64-linux-gnu/libp11-kit.so.0", O_RDONLY|O_CLOEXEC) = 3
read(3, "\177ELF\2\1\1\0\0\0\0\0\0\0\0\0\3\0>\0\1\0\0\0p\24\1\0\0\0\0\0"..., 832) = 832
fstat(3, {st_mode=S_IFREG|0644, st_size=408472, ...}) = 0
mmap(NULL, 4096, PROT_READ|PROT_WRITE, MAP_PRIVATE|MAP_ANONYMOUS, -1, 0) = 0x7f1a233c5000
mmap(NULL, 2504592, PROT_READ|PROT_EXEC, MAP_PRIVATE|MAP_DENYWRITE, 3, 0) = 0x7f1a218ee000
mprotect(0x7f1a21947000, 2093056, PROT_NONE) = 0
mmap(0x7f1a21b46000, 49152, PROT_READ|PROT_WRITE, MAP_PRIVATE|MAP_FIXED|MAP_DENYWRITE, 3, 0x58000) = 0x7f1a21b46000
close(3)                                = 0
access("/etc/ld.so.nohwcap", F_OK)      = -1 ENOENT (No such file or directory)
open("/usr/lib/x86_64-linux-gnu/libidn.so.11", O_RDONLY|O_CLOEXEC) = 3
read(3, "\177ELF\2\1\1\0\0\0\0\0\0\0\0\0\3\0>\0\1\0\0\0p+\0\0\0\0\0\0"..., 832) = 832
fstat(3, {st_mode=S_IFREG|0644, st_size=207208, ...}) = 0
mmap(NULL, 2302192, PROT_READ|PROT_EXEC, MAP_PRIVATE|MAP_DENYWRITE, 3, 0) = 0x7f1a216bb000
mprotect(0x7f1a216ec000, 2097152, PROT_NONE) = 0
mmap(0x7f1a218ec000, 8192, PROT_READ|PROT_WRITE, MAP_PRIVATE|MAP_FIXED|MAP_DENYWRITE, 3, 0x31000) = 0x7f1a218ec000
close(3)                                = 0
access("/etc/ld.so.nohwcap", F_OK)      = -1 ENOENT (No such file or directory)
open("/usr/lib/x86_64-linux-gnu/libtasn1.so.6", O_RDONLY|O_CLOEXEC) = 3
read(3, "\177ELF\2\1\1\0\0\0\0\0\0\0\0\0\3\0>\0\1\0\0\0\340)\0\0\0\0\0\0"..., 832) = 832
fstat(3, {st_mode=S_IFREG|0644, st_size=76192, ...}) = 0
mmap(NULL, 2171912, PROT_READ|PROT_EXEC, MAP_PRIVATE|MAP_DENYWRITE, 3, 0) = 0x7f1a214a8000
mprotect(0x7f1a214b9000, 2097152, PROT_NONE) = 0
mmap(0x7f1a216b9000, 8192, PROT_READ|PROT_WRITE, MAP_PRIVATE|MAP_FIXED|MAP_DENYWRITE, 3, 0x11000) = 0x7f1a216b9000
close(3)                                = 0
access("/etc/ld.so.nohwcap", F_OK)      = -1 ENOENT (No such file or directory)
open("/usr/lib/x86_64-linux-gnu/libnettle.so.6", O_RDONLY|O_CLOEXEC) = 3
read(3, "\177ELF\2\1\1\0\0\0\0\0\0\0\0\0\3\0>\0\1\0\0\0`~\0\0\0\0\0\0"..., 832) = 832
fstat(3, {st_mode=S_IFREG|0644, st_size=219336, ...}) = 0
mmap(NULL, 4096, PROT_READ|PROT_WRITE, MAP_PRIVATE|MAP_ANONYMOUS, -1, 0) = 0x7f1a233c4000
mmap(NULL, 2314384, PROT_READ|PROT_EXEC, MAP_PRIVATE|MAP_DENYWRITE, 3, 0) = 0x7f1a21272000
mprotect(0x7f1a212a6000, 2093056, PROT_NONE) = 0
mmap(0x7f1a214a5000, 12288, PROT_READ|PROT_WRITE, MAP_PRIVATE|MAP_FIXED|MAP_DENYWRITE, 3, 0x33000) = 0x7f1a214a5000
close(3)                                = 0
access("/etc/ld.so.nohwcap", F_OK)      = -1 ENOENT (No such file or directory)
open("/usr/lib/x86_64-linux-gnu/libhogweed.so.4", O_RDONLY|O_CLOEXEC) = 3
read(3, "\177ELF\2\1\1\0\0\0\0\0\0\0\0\0\3\0>\0\1\0\0\0\340e\0\0\0\0\0\0"..., 832) = 832
fstat(3, {st_mode=S_IFREG|0644, st_size=207640, ...}) = 0
mmap(NULL, 2302656, PROT_READ|PROT_EXEC, MAP_PRIVATE|MAP_DENYWRITE, 3, 0) = 0x7f1a2103f000
mprotect(0x7f1a21071000, 2093056, PROT_NONE) = 0
mmap(0x7f1a21270000, 8192, PROT_READ|PROT_WRITE, MAP_PRIVATE|MAP_FIXED|MAP_DENYWRITE, 3, 0x31000) = 0x7f1a21270000
close(3)                                = 0
access("/etc/ld.so.nohwcap", F_OK)      = -1 ENOENT (No such file or directory)
open("/usr/lib/x86_64-linux-gnu/libgmp.so.10", O_RDONLY|O_CLOEXEC) = 3
read(3, "\177ELF\2\1\1\0\0\0\0\0\0\0\0\0\3\0>\0\1\0\0\0\300\223\0\0\0\0\0\0"..., 832) = 832
fstat(3, {st_mode=S_IFREG|0644, st_size=522664, ...}) = 0
mmap(NULL, 2617792, PROT_READ|PROT_EXEC, MAP_PRIVATE|MAP_DENYWRITE, 3, 0) = 0x7f1a20dbf000
mprotect(0x7f1a20e3e000, 2093056, PROT_NONE) = 0
mmap(0x7f1a2103d000, 8192, PROT_READ|PROT_WRITE, MAP_PRIVATE|MAP_FIXED|MAP_DENYWRITE, 3, 0x7e000) = 0x7f1a2103d000
close(3)                                = 0
access("/etc/ld.so.nohwcap", F_OK)      = -1 ENOENT (No such file or directory)
open("/lib/x86_64-linux-gnu/libgpg-error.so.0", O_RDONLY|O_CLOEXEC) = 3
read(3, "\177ELF\2\1\1\0\0\0\0\0\0\0\0\0\3\0>\0\1\0\0\0\320(\0\0\0\0\0\0"..., 832) = 832
fstat(3, {st_mode=S_IFREG|0644, st_size=80496, ...}) = 0
mmap(NULL, 4096, PROT_READ|PROT_WRITE, MAP_PRIVATE|MAP_ANONYMOUS, -1, 0) = 0x7f1a233c3000
mmap(NULL, 2175544, PROT_READ|PROT_EXEC, MAP_PRIVATE|MAP_DENYWRITE, 3, 0) = 0x7f1a20bab000
mprotect(0x7f1a20bbd000, 2097152, PROT_NONE) = 0
mmap(0x7f1a20dbd000, 8192, PROT_READ|PROT_WRITE, MAP_PRIVATE|MAP_FIXED|MAP_DENYWRITE, 3, 0x12000) = 0x7f1a20dbd000
close(3)                                = 0
access("/etc/ld.so.nohwcap", F_OK)      = -1 ENOENT (No such file or directory)
open("/usr/lib/x86_64-linux-gnu/libffi.so.6", O_RDONLY|O_CLOEXEC) = 3
read(3, "\177ELF\2\1\1\0\0\0\0\0\0\0\0\0\3\0>\0\1\0\0\0\360\27\0\0\0\0\0\0"..., 832) = 832
fstat(3, {st_mode=S_IFREG|0644, st_size=31104, ...}) = 0
mmap(NULL, 2127368, PROT_READ|PROT_EXEC, MAP_PRIVATE|MAP_DENYWRITE, 3, 0) = 0x7f1a209a3000
mprotect(0x7f1a209aa000, 2093056, PROT_NONE) = 0
mmap(0x7f1a20ba9000, 8192, PROT_READ|PROT_WRITE, MAP_PRIVATE|MAP_FIXED|MAP_DENYWRITE, 3, 0x6000) = 0x7f1a20ba9000
close(3)                                = 0
mmap(NULL, 4096, PROT_READ|PROT_WRITE, MAP_PRIVATE|MAP_ANONYMOUS, -1, 0) = 0x7f1a233c2000
mmap(NULL, 4096, PROT_READ|PROT_WRITE, MAP_PRIVATE|MAP_ANONYMOUS, -1, 0) = 0x7f1a233c1000
mmap(NULL, 8192, PROT_READ|PROT_WRITE, MAP_PRIVATE|MAP_ANONYMOUS, -1, 0) = 0x7f1a233bf000
arch_prctl(ARCH_SET_FS, 0x7f1a233bf740) = 0
mprotect(0x7f1a22b49000, 16384, PROT_READ) = 0
mprotect(0x7f1a20ba9000, 4096, PROT_READ) = 0
mprotect(0x7f1a20dbd000, 4096, PROT_READ) = 0
mprotect(0x7f1a2103d000, 4096, PROT_READ) = 0
mprotect(0x7f1a214a5000, 8192, PROT_READ) = 0
mprotect(0x7f1a21270000, 4096, PROT_READ) = 0
mprotect(0x7f1a216b9000, 4096, PROT_READ) = 0
mprotect(0x7f1a218ec000, 4096, PROT_READ) = 0
mprotect(0x7f1a22d6a000, 4096, PROT_READ) = 0
mprotect(0x7f1a2257f000, 4096, PROT_READ) = 0
mprotect(0x7f1a21b46000, 40960, PROT_READ) = 0
mprotect(0x7f1a21d6a000, 4096, PROT_READ) = 0
mprotect(0x7f1a22043000, 4096, PROT_READ) = 0
mprotect(0x7f1a2236f000, 45056, PROT_READ) = 0
mprotect(0x7f1a22787000, 4096, PROT_READ) = 0
mprotect(0x7f1a22f86000, 4096, PROT_READ) = 0
mprotect(0x7f1a231a9000, 4096, PROT_READ) = 0
mprotect(0x778000, 28672, PROT_READ)    = 0
mprotect(0x7f1a233d0000, 4096, PROT_READ) = 0
munmap(0x7f1a233c9000, 26155)           = 0
set_tid_address(0x7f1a233bfa10)         = 15573
set_robust_list(0x7f1a233bfa20, 24)     = 0
rt_sigaction(SIGRTMIN, {0x7f1a22b58b50, [], SA_RESTORER|SA_SIGINFO, 0x7f1a22b64390}, NULL, 8) = 0
rt_sigaction(SIGRT_1, {0x7f1a22b58be0, [], SA_RESTORER|SA_RESTART|SA_SIGINFO, 0x7f1a22b64390}, NULL, 8) = 0
rt_sigprocmask(SIG_UNBLOCK, [RTMIN RT_1], NULL, 8) = 0
getrlimit(RLIMIT_STACK, {rlim_cur=8192*1024, rlim_max=RLIM64_INFINITY}) = 0
brk(NULL)                               = 0x14dc000
brk(0x14fd000)                          = 0x14fd000
futex(0x7f1a21b51740, FUTEX_WAKE_PRIVATE, 2147483647) = 0
open("/dev/urandom", O_RDONLY)          = 3
fcntl(3, F_GETFD)                       = 0
fcntl(3, F_SETFD, FD_CLOEXEC)           = 0
fstat(3, {st_mode=S_IFCHR|0666, st_rdev=makedev(1, 9), ...}) = 0
getrusage(0x1 /* RUSAGE_??? */, {ru_utime={0, 0}, ru_stime={0, 8000}, ...}) = 0
read(3, "+\307ExH\312\354\252\365\317\241:,\253\370\307\372\306$\367`\225\274P(7\267?\2525?Q", 32) = 32
read(3, "\211lX\367\25\254\16\312\323\2\265^h\31\3774^\fC\210\202/\330 \303\255PW6<s\341", 32) = 32
read(3, "g\245js\224\20\237\254", 8)    = 8
access("/etc/gcrypt/fips_enabled", F_OK) = -1 ENOENT (No such file or directory)
open("/proc/sys/crypto/fips_enabled", O_RDONLY) = -1 ENOENT (No such file or directory)
open("/etc/gcrypt/hwf.deny", O_RDONLY)  = -1 ENOENT (No such file or directory)
fstat(3, {st_mode=S_IFCHR|0666, st_rdev=makedev(1, 9), ...}) = 0
futex(0x78106c, FUTEX_WAKE_PRIVATE, 2147483647) = 0
futex(0x781078, FUTEX_WAKE_PRIVATE, 2147483647) = 0
brk(0x152d000)                          = 0x152d000
readlink("/proc/self/exe", "/opt/cc/xmrigCCServer", 519) = 21
readlink("/proc/self/exe", "/opt/cc/xmrigCCServer", 519) = 21
pipe2([4, 5], O_CLOEXEC)                = 0
write(5, "*", 1)                        = 1
futex(0x7f1a231aaad0, FUTEX_WAKE_PRIVATE, 2147483647) = 0
clock_getres(CLOCK_MONOTONIC_COARSE, {0, 4000000}) = 0
epoll_create1(EPOLL_CLOEXEC)            = 6
pipe2([7, 8], O_NONBLOCK|O_CLOEXEC)     = 0
eventfd2(0, EFD_CLOEXEC|EFD_NONBLOCK)   = 9
open("/opt/cc/config_cc.json", O_RDONLY|O_CLOEXEC) = 10
fcntl(10, F_GETFL)                      = 0x8000 (flags O_RDONLY|O_LARGEFILE)
fstat(10, {st_mode=S_IFREG|0644, st_size=969, ...}) = 0
read(10, "{\n    \"background\": false,      "..., 8192) = 969
read(10, "", 4096)                      = 0
close(10)                               = 0
ioctl(1, TCGETS, {B38400 opost isig icanon echo ...}) = 0
open("/dev/tty", O_RDWR|O_CLOEXEC)      = 10
dup3(10, 1, O_CLOEXEC)                  = 1
open("/dev/null", O_RDONLY|O_CLOEXEC)   = 11
ioctl(10, FIONBIO, [1])                 = 0
ioctl(0, TCGETS, {B38400 opost isig icanon echo ...}) = 0
open("/dev/tty", O_RDWR|O_CLOEXEC)      = 12
dup3(12, 0, O_CLOEXEC)                  = 0
ioctl(12, FIONBIO, [1])                 = 0
ioctl(12, TCGETS, {B38400 opost isig icanon echo ...}) = 0
ioctl(12, TCGETS, {B38400 opost isig icanon echo ...}) = 0
ioctl(12, SNDCTL_TMR_STOP or TCSETSW, {B38400 opost -isig -icanon -echo ...}) = 0
ioctl(12, TCGETS, {B38400 opost -isig -icanon -echo ...}) = 0
open("cc_log", O_WRONLY|O_CREAT|O_APPEND|O_CLOEXEC, 0644) = 13
rt_sigprocmask(SIG_SETMASK, ~[RTMIN RT_1], [], 8) = 0
read(4, "*", 1)                         = 1
rt_sigaction(SIGHUP, {0x7f1a22f992c0, ~[RTMIN RT_1], SA_RESTORER, 0x7f1a22b64390}, NULL, 8) = 0
write(5, "*", 1)                        = 1
rt_sigprocmask(SIG_SETMASK, [], NULL, 8) = 0
rt_sigprocmask(SIG_SETMASK, ~[RTMIN RT_1], [], 8) = 0
read(4, "*", 1)                         = 1
rt_sigaction(SIGHUP, {SIG_DFL, [], SA_RESTORER, 0x7f1a22b64390}, NULL, 8) = 0
write(5, "*", 1)                        = 1
rt_sigprocmask(SIG_SETMASK, [], NULL, 8) = 0
rt_sigprocmask(SIG_SETMASK, ~[RTMIN RT_1], [], 8) = 0
read(4, "*", 1)                         = 1
rt_sigaction(SIGTERM, {0x7f1a22f992c0, ~[RTMIN RT_1], SA_RESTORER, 0x7f1a22b64390}, NULL, 8) = 0
write(5, "*", 1)                        = 1
rt_sigprocmask(SIG_SETMASK, [], NULL, 8) = 0
rt_sigprocmask(SIG_SETMASK, ~[RTMIN RT_1], [], 8) = 0
read(4, "*", 1)                         = 1
rt_sigaction(SIGTERM, {SIG_DFL, [], SA_RESTORER, 0x7f1a22b64390}, NULL, 8) = 0
write(5, "*", 1)                        = 1
rt_sigprocmask(SIG_SETMASK, [], NULL, 8) = 0
rt_sigprocmask(SIG_SETMASK, ~[RTMIN RT_1], [], 8) = 0
read(4, "*", 1)                         = 1
rt_sigaction(SIGINT, {0x7f1a22f992c0, ~[RTMIN RT_1], SA_RESTORER, 0x7f1a22b64390}, NULL, 8) = 0
write(5, "*", 1)                        = 1
rt_sigprocmask(SIG_SETMASK, [], NULL, 8) = 0
ioctl(1, TCGETS, {B38400 opost -isig -icanon -echo ...}) = 0
write(10, " * VERSIONS:     XMRigCC/1.4.0 ("..., 76) = 76
open("/etc/localtime", O_RDONLY|O_CLOEXEC) = 14
fstat(14, {st_mode=S_IFREG|0644, st_size=2384, ...}) = 0
fstat(14, {st_mode=S_IFREG|0644, st_size=2384, ...}) = 0
read(14, "TZif2\0\0\0\0\0\0\0\0\0\0\0\0\0\0\0\0\0\0\t\0\0\0\t\0\0\0\0"..., 4096) = 2384
lseek(14, -1506, SEEK_CUR)              = 878
read(14, "TZif2\0\0\0\0\0\0\0\0\0\0\0\0\0\0\0\0\0\0\n\0\0\0\n\0\0\0\0"..., 4096) = 1506
close(14)                               = 0
mmap(NULL, 8392704, PROT_READ|PROT_WRITE, MAP_PRIVATE|MAP_ANONYMOUS|MAP_STACK, -1, 0) = 0x7f1a201a2000
mprotect(0x7f1a201a2000, 4096, PROT_NONE) = 0
clone(child_stack=0x7f1a209a1fb0, flags=CLONE_VM|CLONE_FS|CLONE_FILES|CLONE_SIGHAND|CLONE_THREAD|CLONE_SYSVSEM|CLONE_SETTLS|CLONE_PARENT_SETTID|CLONE_CHILD_CLEARTID, parent_tidptr=0x7f1a209a29d0, tls=0x7f1a209a2700, child_tidptr=0x7f1a209a29d0) = 15574
mmap(NULL, 8392704, PROT_READ|PROT_WRITE, MAP_PRIVATE|MAP_ANONYMOUS|MAP_STACK, -1, 0) = 0x7f1a1f9a1000
mprotect(0x7f1a1f9a1000, 4096, PROT_NONE) = 0
clone(child_stack=0x7f1a201a0fb0, flags=CLONE_VM|CLONE_FS|CLONE_FILES|CLONE_SIGHAND|CLONE_THREAD|CLONE_SYSVSEM|CLONE_SETTLS|CLONE_PARENT_SETTID|CLONE_CHILD_CLEARTID, parent_tidptr=0x7f1a201a19d0, tls=0x7f1a201a1700, child_tidptr=0x7f1a201a19d0) = 15575
mmap(NULL, 8392704, PROT_READ|PROT_WRITE, MAP_PRIVATE|MAP_ANONYMOUS|MAP_STACK, -1, 0) = 0x7f1a1f1a0000
mprotect(0x7f1a1f1a0000, 4096, PROT_NONE) = 0
clone(child_stack=0x7f1a1f99ffb0, flags=CLONE_VM|CLONE_FS|CLONE_FILES|CLONE_SIGHAND|CLONE_THREAD|CLONE_SYSVSEM|CLONE_SETTLS|CLONE_PARENT_SETTID|CLONE_CHILD_CLEARTID, parent_tidptr=0x7f1a1f9a09d0, tls=0x7f1a1f9a0700, child_tidptr=0x7f1a1f9a09d0) = 15576
mmap(NULL, 8392704, PROT_READ|PROT_WRITE, MAP_PRIVATE|MAP_ANONYMOUS|MAP_STACK, -1, 0) = 0x7f1a1e99f000
mprotect(0x7f1a1e99f000, 4096, PROT_NONE) = 0
clone(child_stack=0x7f1a1f19efb0, flags=CLONE_VM|CLONE_FS|CLONE_FILES|CLONE_SIGHAND|CLONE_THREAD|CLONE_SYSVSEM|CLONE_SETTLS|CLONE_PARENT_SETTID|CLONE_CHILD_CLEARTID, parent_tidptr=0x7f1a1f19f9d0, tls=0x7f1a1f19f700, child_tidptr=0x7f1a1f19f9d0) = 15577
futex(0x7f1a231aa710, FUTEX_WAKE_PRIVATE, 2147483647) = 0
futex(0x7f1a231aa6e4, FUTEX_WAKE_OP_PRIVATE, 1, 1, 0x7f1a231aa6e0, {FUTEX_OP_SET, 0, FUTEX_OP_CMP_GT, 1}) = 1
futex(0x7f1a231aa6a0, FUTEX_WAKE_PRIVATE, 1) = 1
ioctl(1, TCGETS, {B38400 opost -isig -icanon -echo ...}) = 0
write(10, " * COMMANDS:     'q' Quit\n", 26) = 26
futex(0x7f1a231aa6e4, FUTEX_WAKE_OP_PRIVATE, 1, 1, 0x7f1a231aa6e0, {FUTEX_OP_SET, 0, FUTEX_OP_CMP_GT, 1}) = 1
futex(0x7f1a231aa6a0, FUTEX_WAKE_PRIVATE, 1) = 1
socket(PF_INET, SOCK_STREAM|SOCK_CLOEXEC, IPPROTO_IP) = 14
setsockopt(14, SOL_SOCKET, SO_REUSEADDR, [1], 4) = 0
bind(14, {sa_family=AF_INET, sin_port=htons(80), sin_addr=inet_addr("0.0.0.0")}, 16) = 0
listen(14, 32)                          = 0
mmap(NULL, 8392704, PROT_READ|PROT_WRITE, MAP_PRIVATE|MAP_ANONYMOUS|MAP_STACK, -1, 0) = 0x7f1a1e19e000
mprotect(0x7f1a1e19e000, 4096, PROT_NONE) = 0
clone(child_stack=0x7f1a1e99dfb0, flags=CLONE_VM|CLONE_FS|CLONE_FILES|CLONE_SIGHAND|CLONE_THREAD|CLONE_SYSVSEM|CLONE_SETTLS|CLONE_PARENT_SETTID|CLONE_CHILD_CLEARTID, parent_tidptr=0x7f1a1e99e9d0, tls=0x7f1a1e99e700, child_tidptr=0x7f1a1e99e9d0) = 15578
open("/proc/self/task/15578/comm", O_RDWR) = 15
write(15, "libmicrohttpd", 13)          = 13
close(15)                               = 0
ioctl(1, TCGETS, {B38400 opost -isig -icanon -echo ...}) = 0
write(10, "[2018-02-16 09:00:13] XMRigCC Se"..., 57) = 57
futex(0x7f1a231aa6e4, FUTEX_WAKE_OP_PRIVATE, 1, 1, 0x7f1a231aa6e0, {FUTEX_OP_SET, 0, FUTEX_OP_CMP_GT, 1}) = 1
futex(0x7f1a231aa6a0, FUTEX_WAKE_PRIVATE, 1) = 1
epoll_ctl(6, EPOLL_CTL_ADD, 7, {EPOLLIN, {u32=7, u64=7}}) = 0
epoll_ctl(6, EPOLL_CTL_ADD, 9, {EPOLLIN, {u32=9, u64=9}}) = 0
epoll_ctl(6, EPOLL_CTL_ADD, 12, {EPOLLIN, {u32=12, u64=12}}) = 0
epoll_wait(6, [{EPOLLIN, {u32=9, u64=9}}], 1024, -1) = 1
read(9, "\1\0\0\0\0\0\0\0", 1024)       = 8
epoll_wait(6, [{EPOLLIN, {u32=9, u64=9}}], 1024, -1) = 1
read(9, "\1\0\0\0\0\0\0\0", 1024)       = 8
epoll_wait(6, [{EPOLLIN, {u32=9, u64=9}}], 1024, -1) = 1
read(9, "\1\0\0\0\0\0\0\0", 1024)       = 8
epoll_wait(6, [{EPOLLIN, {u32=9, u64=9}}], 1024, -1) = 1
read(9, "\1\0\0\0\0\0\0\0", 1024)       = 8
epoll_wait(6, [{EPOLLIN, {u32=9, u64=9}}], 1024, -1) = 1
read(9, "\1\0\0\0\0\0\0\0", 1024)       = 8
epoll_wait(6, [{EPOLLIN, {u32=9, u64=9}}], 1024, -1) = 1
read(9, "\1\0\0\0\0\0\0\0", 1024)       = 8
epoll_wait(6, [{EPOLLIN, {u32=9, u64=9}}], 1024, -1) = 1
read(9, "\1\0\0\0\0\0\0\0", 1024)       = 8
epoll_wait(6, [{EPOLLIN, {u32=9, u64=9}}], 1024, -1) = 1
read(9, "\1\0\0\0\0\0\0\0", 1024)       = 8
epoll_wait(6, [{EPOLLIN, {u32=9, u64=9}}], 1024, -1) = 1
read(9, "\1\0\0\0\0\0\0\0", 1024)       = 8
epoll_wait(6, [{EPOLLIN, {u32=9, u64=9}}], 1024, -1) = 1
read(9, "\1\0\0\0\0\0\0\0", 1024)       = 8
epoll_wait(6, [{EPOLLIN, {u32=9, u64=9}}], 1024, -1) = 1
read(9, "\1\0\0\0\0\0\0\0", 1024)       = 8
epoll_wait(6, [{EPOLLIN, {u32=9, u64=9}}], 1024, -1) = 1
read(9, "\1\0\0\0\0\0\0\0", 1024)       = 8
epoll_wait(6, [{EPOLLIN, {u32=9, u64=9}}], 1024, -1) = 1
read(9, "\1\0\0\0\0\0\0\0", 1024)       = 8
epoll_wait(6, [{EPOLLIN, {u32=9, u64=9}}], 1024, -1) = 1
read(9, "\1\0\0\0\0\0\0\0", 1024)       = 8
epoll_wait(6, [{EPOLLIN, {u32=9, u64=9}}], 1024, -1) = 1
read(9, "\1\0\0\0\0\0\0\0", 1024)       = 8
epoll_wait(6, [{EPOLLIN, {u32=9, u64=9}}], 1024, -1) = 1
read(9, "\1\0\0\0\0\0\0\0", 1024)       = 8
epoll_wait(6, [{EPOLLIN, {u32=9, u64=9}}], 1024, -1) = 1
read(9, "\1\0\0\0\0\0\0\0", 1024)       = 8
epoll_wait(6, [{EPOLLIN, {u32=9, u64=9}}], 1024, -1) = 1
read(9, "\1\0\0\0\0\0\0\0", 1024)       = 8
epoll_wait(6, [{EPOLLIN, {u32=9, u64=9}}], 1024, -1) = 1
read(9, "\1\0\0\0\0\0\0\0", 1024)       = 8
epoll_wait(6, [{EPOLLIN, {u32=9, u64=9}}], 1024, -1) = 1
read(9, "\1\0\0\0\0\0\0\0", 1024)       = 8
epoll_wait(6, [{EPOLLIN, {u32=9, u64=9}}], 1024, -1) = 1
read(9, "\1\0\0\0\0\0\0\0", 1024)       = 8
epoll_wait(6, [{EPOLLIN, {u32=9, u64=9}}], 1024, -1) = 1
read(9, "\1\0\0\0\0\0\0\0", 1024)       = 8
epoll_wait(6, [{EPOLLIN, {u32=9, u64=9}}], 1024, -1) = 1
read(9, "\1\0\0\0\0\0\0\0", 1024)       = 8
epoll_wait(6, [{EPOLLIN, {u32=9, u64=9}}], 1024, -1) = 1
read(9, "\1\0\0\0\0\0\0\0", 1024)       = 8
epoll_wait(6, [{EPOLLIN, {u32=9, u64=9}}], 1024, -1) = 1
read(9, "\1\0\0\0\0\0\0\0", 1024)       = 8
epoll_wait(6, [{EPOLLIN, {u32=9, u64=9}}], 1024, -1) = 1
read(9, "\1\0\0\0\0\0\0\0", 1024)       = 8
epoll_wait(6, [{EPOLLIN, {u32=9, u64=9}}], 1024, -1) = 1
read(9, "\1\0\0\0\0\0\0\0", 1024)       = 8
epoll_wait(6, [{EPOLLIN, {u32=9, u64=9}}], 1024, -1) = 1
read(9, "\1\0\0\0\0\0\0\0", 1024)       = 8
epoll_wait(6, [{EPOLLIN, {u32=9, u64=9}}], 1024, -1) = 1
read(9, "\1\0\0\0\0\0\0\0", 1024)       = 8
epoll_wait(6, [{EPOLLIN, {u32=9, u64=9}}], 1024, -1) = 1
read(9, "\1\0\0\0\0\0\0\0", 1024)       = 8
epoll_wait(6, [{EPOLLIN, {u32=9, u64=9}}], 1024, -1) = 1
read(9, "\1\0\0\0\0\0\0\0", 1024)       = 8
epoll_wait(6, [{EPOLLIN, {u32=9, u64=9}}], 1024, -1) = 1
read(9, "\1\0\0\0\0\0\0\0", 1024)       = 8
epoll_wait(6, [{EPOLLIN, {u32=9, u64=9}}], 1024, -1) = 1
read(9, "\1\0\0\0\0\0\0\0", 1024)       = 8
epoll_wait(6, [{EPOLLIN, {u32=9, u64=9}}], 1024, -1) = 1
read(9, "\1\0\0\0\0\0\0\0", 1024)       = 8
epoll_wait(6, [{EPOLLIN, {u32=9, u64=9}}], 1024, -1) = 1
read(9, "\1\0\0\0\0\0\0\0", 1024)       = 8
epoll_wait(6, [{EPOLLIN, {u32=9, u64=9}}], 1024, -1) = 1
read(9, "\1\0\0\0\0\0\0\0", 1024)       = 8
epoll_wait(6, [{EPOLLIN, {u32=9, u64=9}}], 1024, -1) = 1
read(9, "\1\0\0\0\0\0\0\0", 1024)       = 8
epoll_wait(6, [{EPOLLIN, {u32=9, u64=9}}], 1024, -1) = 1
read(9, "\1\0\0\0\0\0\0\0", 1024)       = 8
epoll_wait(6, [{EPOLLIN, {u32=9, u64=9}}], 1024, -1) = 1
read(9, "\1\0\0\0\0\0\0\0", 1024)       = 8
epoll_wait(6, [{EPOLLIN, {u32=9, u64=9}}], 1024, -1) = 1
read(9, "\1\0\0\0\0\0\0\0", 1024)       = 8
epoll_wait(6, [{EPOLLIN, {u32=9, u64=9}}], 1024, -1) = 1
read(9, "\1\0\0\0\0\0\0\0", 1024)       = 8
epoll_wait(6, [{EPOLLIN, {u32=9, u64=9}}], 1024, -1) = 1
read(9, "\1\0\0\0\0\0\0\0", 1024)       = 8
epoll_wait(6, [{EPOLLIN, {u32=9, u64=9}}], 1024, -1) = 1
read(9, "\1\0\0\0\0\0\0\0", 1024)       = 8
epoll_wait(6, [{EPOLLIN, {u32=9, u64=9}}], 1024, -1) = 1
read(9, "\1\0\0\0\0\0\0\0", 1024)       = 8
epoll_wait(6, [{EPOLLIN, {u32=9, u64=9}}], 1024, -1) = 1
read(9, "\1\0\0\0\0\0\0\0", 1024)       = 8
epoll_wait(6, [{EPOLLIN, {u32=9, u64=9}}], 1024, -1) = 1
read(9, "\1\0\0\0\0\0\0\0", 1024)       = 8
epoll_wait(6, [{EPOLLIN, {u32=9, u64=9}}], 1024, -1) = 1
read(9, "\1\0\0\0\0\0\0\0", 1024)       = 8
epoll_wait(6, [{EPOLLIN, {u32=9, u64=9}}], 1024, -1) = 1
read(9, "\1\0\0\0\0\0\0\0", 1024)       = 8
epoll_wait(6, [{EPOLLIN, {u32=9, u64=9}}], 1024, -1) = 1
read(9, "\1\0\0\0\0\0\0\0", 1024)       = 8
epoll_wait(6, [{EPOLLIN, {u32=9, u64=9}}], 1024, -1) = 1
read(9, "\1\0\0\0\0\0\0\0", 1024)       = 8
epoll_wait(6, [{EPOLLIN, {u32=9, u64=9}}], 1024, -1) = 1
read(9, "\1\0\0\0\0\0\0\0", 1024)       = 8
epoll_wait(6, [{EPOLLIN, {u32=9, u64=9}}], 1024, -1) = 1
read(9, "\1\0\0\0\0\0\0\0", 1024)       = 8
epoll_wait(6, [{EPOLLIN, {u32=9, u64=9}}], 1024, -1) = 1
read(9, "\1\0\0\0\0\0\0\0", 1024)       = 8
epoll_wait(6, [{EPOLLIN, {u32=9, u64=9}}], 1024, -1) = 1
read(9, "\1\0\0\0\0\0\0\0", 1024)       = 8
epoll_wait(6, [{EPOLLIN, {u32=9, u64=9}}], 1024, -1) = 1
read(9, "\1\0\0\0\0\0\0\0", 1024)       = 8
epoll_wait(6, [{EPOLLIN, {u32=9, u64=9}}], 1024, -1) = 1
read(9, "\1\0\0\0\0\0\0\0", 1024)       = 8
futex(0x7f1a18000020, FUTEX_WAIT_PRIVATE, 2, NULL) = -1 EAGAIN (Resource temporarily unavailable)
futex(0x7f1a18000020, FUTEX_WAKE_PRIVATE, 1) = 0
epoll_wait(6, [{EPOLLIN, {u32=9, u64=9}}], 1024, -1) = 1
read(9, "\1\0\0\0\0\0\0\0", 1024)       = 8
epoll_wait(6, [{EPOLLIN, {u32=9, u64=9}}], 1024, -1) = 1
read(9, "\1\0\0\0\0\0\0\0", 1024)       = 8
epoll_wait(6, [{EPOLLIN, {u32=9, u64=9}}], 1024, -1) = 1
read(9, "\1\0\0\0\0\0\0\0", 1024)       = 8
futex(0x7f1a18000020, FUTEX_WAKE_PRIVATE, 1) = 0
epoll_wait(6, [{EPOLLIN, {u32=9, u64=9}}], 1024, -1) = 1
read(9, "\1\0\0\0\0\0\0\0", 1024)       = 8
epoll_wait(6, [{EPOLLIN, {u32=9, u64=9}}], 1024, -1) = 1
read(9, "\1\0\0\0\0\0\0\0", 1024)       = 8
epoll_wait(6, [{EPOLLIN, {u32=9, u64=9}}], 1024, -1) = 1
read(9, "\1\0\0\0\0\0\0\0", 1024)       = 8
epoll_wait(6, [{EPOLLIN, {u32=9, u64=9}}], 1024, -1) = 1
read(9, "\1\0\0\0\0\0\0\0", 1024)       = 8
epoll_wait(6, [{EPOLLIN, {u32=9, u64=9}}], 1024, -1) = 1
read(9, "\1\0\0\0\0\0\0\0", 1024)       = 8
epoll_wait(6, [{EPOLLIN, {u32=9, u64=9}}], 1024, -1) = 1
read(9, "\1\0\0\0\0\0\0\0", 1024)       = 8
epoll_wait(6, [{EPOLLIN, {u32=9, u64=9}}], 1024, -1) = 1
read(9, "\1\0\0\0\0\0\0\0", 1024)       = 8
epoll_wait(6, [{EPOLLIN, {u32=9, u64=9}}], 1024, -1) = 1
read(9, "\1\0\0\0\0\0\0\0", 1024)       = 8
epoll_wait(6, [{EPOLLIN, {u32=9, u64=9}}], 1024, -1) = 1
read(9, "\1\0\0\0\0\0\0\0", 1024)       = 8
epoll_wait(6, [{EPOLLIN, {u32=9, u64=9}}], 1024, -1) = 1
read(9, "\1\0\0\0\0\0\0\0", 1024)       = 8
epoll_wait(6, [{EPOLLIN, {u32=9, u64=9}}], 1024, -1) = 1
read(9, "\1\0\0\0\0\0\0\0", 1024)       = 8
epoll_wait(6, [{EPOLLIN, {u32=9, u64=9}}], 1024, -1) = 1
read(9, "\1\0\0\0\0\0\0\0", 1024)       = 8
epoll_wait(6, [{EPOLLIN, {u32=9, u64=9}}], 1024, -1) = 1
read(9, "\1\0\0\0\0\0\0\0", 1024)       = 8
epoll_wait(6, [{EPOLLIN, {u32=9, u64=9}}], 1024, -1) = 1
read(9, "\1\0\0\0\0\0\0\0", 1024)       = 8
epoll_wait(6, [{EPOLLIN, {u32=9, u64=9}}], 1024, -1) = 1
read(9, "\1\0\0\0\0\0\0\0", 1024)       = 8
epoll_wait(6, [{EPOLLIN, {u32=9, u64=9}}], 1024, -1) = 1
read(9, "\1\0\0\0\0\0\0\0", 1024)       = 8
epoll_wait(6, [{EPOLLIN, {u32=9, u64=9}}], 1024, -1) = 1
read(9, "\1\0\0\0\0\0\0\0", 1024)       = 8
epoll_wait(6, [{EPOLLIN, {u32=9, u64=9}}], 1024, -1) = 1
read(9, "\1\0\0\0\0\0\0\0", 1024)       = 8
epoll_wait(6, [{EPOLLIN, {u32=9, u64=9}}], 1024, -1) = 1
read(9, "\1\0\0\0\0\0\0\0", 1024)       = 8
epoll_wait(6, [{EPOLLIN, {u32=9, u64=9}}], 1024, -1) = 1
read(9, "\1\0\0\0\0\0\0\0", 1024)       = 8
epoll_wait(6, [{EPOLLIN, {u32=9, u64=9}}], 1024, -1) = 1
read(9, "\1\0\0\0\0\0\0\0", 1024)       = 8
epoll_wait(6, [{EPOLLIN, {u32=9, u64=9}}], 1024, -1) = 1
read(9, "\1\0\0\0\0\0\0\0", 1024)       = 8
epoll_wait(6, [{EPOLLIN, {u32=9, u64=9}}], 1024, -1) = 1
read(9, "\1\0\0\0\0\0\0\0", 1024)       = 8
epoll_wait(6, [{EPOLLIN, {u32=9, u64=9}}], 1024, -1) = 1
read(9, "\1\0\0\0\0\0\0\0", 1024)       = 8
epoll_wait(6, [{EPOLLIN, {u32=9, u64=9}}], 1024, -1) = 1
read(9, "\1\0\0\0\0\0\0\0", 1024)       = 8
epoll_wait(6, [{EPOLLIN, {u32=9, u64=9}}], 1024, -1) = 1
read(9, "\1\0\0\0\0\0\0\0", 1024)       = 8
epoll_wait(6, [{EPOLLIN, {u32=9, u64=9}}], 1024, -1) = 1
read(9, "\1\0\0\0\0\0\0\0", 1024)       = 8
epoll_wait(6, [{EPOLLIN, {u32=9, u64=9}}], 1024, -1) = 1
read(9, "\1\0\0\0\0\0\0\0", 1024)       = 8
epoll_wait(6, [{EPOLLIN, {u32=9, u64=9}}], 1024, -1) = 1
read(9, "\1\0\0\0\0\0\0\0", 1024)       = 8
epoll_wait(6, [{EPOLLIN, {u32=9, u64=9}}], 1024, -1) = 1
read(9, "\1\0\0\0\0\0\0\0", 1024)       = 8
epoll_wait(6, [{EPOLLIN, {u32=9, u64=9}}], 1024, -1) = 1
read(9, "\1\0\0\0\0\0\0\0", 1024)       = 8
epoll_wait(6, [{EPOLLIN, {u32=9, u64=9}}], 1024, -1) = 1
read(9, "\1\0\0\0\0\0\0\0", 1024)       = 8
epoll_wait(6, [{EPOLLIN, {u32=9, u64=9}}], 1024, -1) = 1
read(9, "\1\0\0\0\0\0\0\0", 1024)       = 8
epoll_wait(6, [{EPOLLIN, {u32=9, u64=9}}], 1024, -1) = 1
read(9, "\1\0\0\0\0\0\0\0", 1024)       = 8
epoll_wait(6, [{EPOLLIN, {u32=9, u64=9}}], 1024, -1) = 1
read(9, "\1\0\0\0\0\0\0\0", 1024)       = 8
epoll_wait(6, [{EPOLLIN, {u32=9, u64=9}}], 1024, -1) = 1
read(9, "\1\0\0\0\0\0\0\0", 1024)       = 8
epoll_wait(6, [{EPOLLIN, {u32=9, u64=9}}], 1024, -1) = 1
read(9, "\1\0\0\0\0\0\0\0", 1024)       = 8
epoll_wait(6, [{EPOLLIN, {u32=9, u64=9}}], 1024, -1) = 1
read(9, "\1\0\0\0\0\0\0\0", 1024)       = 8
epoll_wait(6, [{EPOLLIN, {u32=9, u64=9}}], 1024, -1) = 1
read(9, "\1\0\0\0\0\0\0\0", 1024)       = 8
epoll_wait(6, [{EPOLLIN, {u32=9, u64=9}}], 1024, -1) = 1
read(9, "\1\0\0\0\0\0\0\0", 1024)       = 8
epoll_wait(6, [{EPOLLIN, {u32=9, u64=9}}], 1024, -1) = 1
read(9, "\1\0\0\0\0\0\0\0", 1024)       = 8
futex(0x7f1a18000020, FUTEX_WAIT_PRIVATE, 2, NULL) = -1 EAGAIN (Resource temporarily unavailable)
futex(0x7f1a18000020, FUTEX_WAKE_PRIVATE, 1) = 0
epoll_wait(6, [{EPOLLIN, {u32=9, u64=9}}], 1024, -1) = 1
read(9, "\1\0\0\0\0\0\0\0", 1024)       = 8
epoll_wait(6, [{EPOLLIN, {u32=9, u64=9}}], 1024, -1) = 1
read(9, "\1\0\0\0\0\0\0\0", 1024)       = 8
epoll_wait(6, [{EPOLLIN, {u32=9, u64=9}}], 1024, -1) = 1
read(9, "\1\0\0\0\0\0\0\0", 1024)       = 8
epoll_wait(6, [{EPOLLIN, {u32=9, u64=9}}], 1024, -1) = 1
read(9, "\1\0\0\0\0\0\0\0", 1024)       = 8
futex(0x7f1a18000020, FUTEX_WAIT_PRIVATE, 2, NULL) = -1 EAGAIN (Resource temporarily unavailable)
futex(0x7f1a18000020, FUTEX_WAKE_PRIVATE, 1) = 0
epoll_wait(6, [{EPOLLIN, {u32=9, u64=9}}], 1024, -1) = 1
read(9, "\1\0\0\0\0\0\0\0", 1024)       = 8
epoll_wait(6, [{EPOLLIN, {u32=9, u64=9}}], 1024, -1) = 1
read(9, "\1\0\0\0\0\0\0\0", 1024)       = 8
epoll_wait(6, [{EPOLLIN, {u32=9, u64=9}}], 1024, -1) = 1
read(9, "\1\0\0\0\0\0\0\0", 1024)       = 8
epoll_wait(6, [{EPOLLIN, {u32=9, u64=9}}], 1024, -1) = 1
read(9, "\1\0\0\0\0\0\0\0", 1024)       = 8
epoll_wait(6, [{EPOLLIN, {u32=9, u64=9}}], 1024, -1) = 1
read(9, "\1\0\0\0\0\0\0\0", 1024)       = 8
epoll_wait(6, [{EPOLLIN, {u32=9, u64=9}}], 1024, -1) = 1
read(9, "\1\0\0\0\0\0\0\0", 1024)       = 8
epoll_wait(6, [{EPOLLIN, {u32=9, u64=9}}], 1024, -1) = 1
read(9, "\1\0\0\0\0\0\0\0", 1024)       = 8
epoll_wait(6, [{EPOLLIN, {u32=9, u64=9}}], 1024, -1) = 1
read(9, "\1\0\0\0\0\0\0\0", 1024)       = 8
epoll_wait(6, [{EPOLLIN, {u32=9, u64=9}}], 1024, -1) = 1
read(9, "\1\0\0\0\0\0\0\0", 1024)       = 8
epoll_wait(6, [{EPOLLIN, {u32=9, u64=9}}], 1024, -1) = 1
read(9, "\1\0\0\0\0\0\0\0", 1024)       = 8
epoll_wait(6, [{EPOLLIN, {u32=9, u64=9}}], 1024, -1) = 1
read(9, "\1\0\0\0\0\0\0\0", 1024)       = 8
epoll_wait(6, [{EPOLLIN, {u32=9, u64=9}}], 1024, -1) = 1
read(9, "\1\0\0\0\0\0\0\0", 1024)       = 8
epoll_wait(6, [{EPOLLIN, {u32=9, u64=9}}], 1024, -1) = 1
read(9, "\1\0\0\0\0\0\0\0", 1024)       = 8
epoll_wait(6, [{EPOLLIN, {u32=9, u64=9}}], 1024, -1) = 1
read(9, "\1\0\0\0\0\0\0\0", 1024)       = 8
epoll_wait(6, [{EPOLLIN, {u32=9, u64=9}}], 1024, -1) = 1
read(9, "\1\0\0\0\0\0\0\0", 1024)       = 8
epoll_wait(6, [{EPOLLIN, {u32=9, u64=9}}], 1024, -1) = 1
read(9, "\1\0\0\0\0\0\0\0", 1024)       = 8
futex(0x7f1a18000020, FUTEX_WAKE_PRIVATE, 1) = 0
epoll_wait(6, [{EPOLLIN, {u32=9, u64=9}}], 1024, -1) = 1
read(9, "\1\0\0\0\0\0\0\0", 1024)       = 8
epoll_wait(6, [{EPOLLIN, {u32=9, u64=9}}], 1024, -1) = 1
read(9, "\1\0\0\0\0\0\0\0", 1024)       = 8
epoll_wait(6, [{EPOLLIN, {u32=9, u64=9}}], 1024, -1) = 1
read(9, "\1\0\0\0\0\0\0\0", 1024)       = 8
epoll_wait(6, [{EPOLLIN, {u32=9, u64=9}}], 1024, -1) = 1
read(9, "\1\0\0\0\0\0\0\0", 1024)       = 8
epoll_wait(6, [{EPOLLIN, {u32=9, u64=9}}], 1024, -1) = 1
read(9, "\1\0\0\0\0\0\0\0", 1024)       = 8
futex(0x7f1a18000020, FUTEX_WAIT_PRIVATE, 2, NULL) = -1 EAGAIN (Resource temporarily unavailable)
futex(0x7f1a18000020, FUTEX_WAKE_PRIVATE, 1) = 0
epoll_wait(6, [{EPOLLIN, {u32=9, u64=9}}], 1024, -1) = 1
read(9, "\1\0\0\0\0\0\0\0", 1024)       = 8
epoll_wait(6, [{EPOLLIN, {u32=9, u64=9}}], 1024, -1) = 1
read(9, "\1\0\0\0\0\0\0\0", 1024)       = 8
epoll_wait(6, [{EPOLLIN, {u32=9, u64=9}}], 1024, -1) = 1
read(9, "\1\0\0\0\0\0\0\0", 1024)       = 8
write(10, "[2018-02-16 09:00:27] Status fro"..., 52) = 52
--- SIGSEGV {si_signo=SIGSEGV, si_code=SEGV_MAPERR, si_addr=0x200009} ---
+++ killed by SIGSEGV (core dumped) +++

**Comment by Bendr0id** [comment]
Hmm, does it happen immediately after start?

Even when only some miners are connected?

Could it be that the server is not allowed to create files in it's directory / missing rw permissions?

Every miner sends its own config to the server at startup. The server also needs to read files from the file system, like index.html dashboard file and the client configs.

Is the XMRigCCServer started as a service?

Am 16.02.2018 19:03 schrieb mamkinminer <notifications@github.com>:

And strace output:

execve("./xmrigCCServer", ["./xmrigCCServer"], [/* 20 vars /]) = 0
brk(NULL) = 0x14dc000
access("/etc/ld.so.nohwcap", F_OK) = -1 ENOENT (No such file or directory)
access("/etc/ld.so.preload", R_OK) = -1 ENOENT (No such file or directory)
open("/etc/ld.so.cache", O_RDONLY|O_CLOEXEC) = 3
fstat(3, {st_mode=S_IFREG|0644, st_size=26155, ...}) = 0
mmap(NULL, 26155, PROT_READ, MAP_PRIVATE, 3, 0) = 0x7f1a233c9000
close(3) = 0
access("/etc/ld.so.nohwcap", F_OK) = -1 ENOENT (No such file or directory)
open("/usr/lib/x86_64-linux-gnu/libuv.so.1", O_RDONLY|O_CLOEXEC) = 3
read(3, "\177ELF\2\1\1\0\0\0\0\0\0\0\0\0\3\0>\0\1\0\0\0@a\0\0\0\0\0\0"..., 832) = 832
fstat(3, {st_mode=S_IFREG|0644, st_size=142640, ...}) = 0
mmap(NULL, 4096, PROT_READ|PROT_WRITE, MAP_PRIVATE|MAP_ANONYMOUS, -1, 0) = 0x7f1a233c8000
mmap(NULL, 2239336, PROT_READ|PROT_EXEC, MAP_PRIVATE|MAP_DENYWRITE, 3, 0) = 0x7f1a22f88000
mprotect(0x7f1a22faa000, 2093056, PROT_NONE) = 0
mmap(0x7f1a231a9000, 8192, PROT_READ|PROT_WRITE, MAP_PRIVATE|MAP_FIXED|MAP_DENYWRITE, 3, 0x21000) = 0x7f1a231a9000
close(3) = 0
access("/etc/ld.so.nohwcap", F_OK) = -1 ENOENT (No such file or directory)
open("/usr/lib/x86_64-linux-gnu/libmicrohttpd.so.10", O_RDONLY|O_CLOEXEC) = 3
read(3, "\177ELF\2\1\1\0\0\0\0\0\0\0\0\0\3\0>\0\1\0\0\0\200;\0\0\0\0\0\0"..., 832) = 832
fstat(3, {st_mode=S_IFREG|0644, st_size=97232, ...}) = 0
mmap(NULL, 2192344, PROT_READ|PROT_EXEC, MAP_PRIVATE|MAP_DENYWRITE, 3, 0) = 0x7f1a22d70000
mprotect(0x7f1a22d87000, 2093056, PROT_NONE) = 0
mmap(0x7f1a22f86000, 8192, PROT_READ|PROT_WRITE, MAP_PRIVATE|MAP_FIXED|MAP_DENYWRITE, 3, 0x16000) = 0x7f1a22f86000
close(3) = 0
access("/etc/ld.so.nohwcap", F_OK) = -1 ENOENT (No such file or directory)
open("/lib/x86_64-linux-gnu/libpthread.so.0", O_RDONLY|O_CLOEXEC) = 3
read(3, "\177ELF\2\1\1\0\0\0\0\0\0\0\0\0\3\0>\0\1\0\0\0\260\0\0\0\0\0\0"..., 832) = 832 fstat(3, {st_mode=S_IFREG|0755, st_size=138696, ...}) = 0 mmap(NULL, 2212904, PROT_READ|PROT_EXEC, MAP_PRIVATE|MAP_DENYWRITE, 3, 0) = 0x7f1a22b53000 mprotect(0x7f1a22b6b000, 2093056, PROT_NONE) = 0 mmap(0x7f1a22d6a000, 8192, PROT_READ|PROT_WRITE, MAP_PRIVATE|MAP_FIXED|MAP_DENYWRITE, 3, 0x17000) = 0x7f1a22d6a000 mmap(0x7f1a22d6c000, 13352, PROT_READ|PROT_WRITE, MAP_PRIVATE|MAP_FIXED|MAP_ANONYMOUS, -1, 0) = 0x7f1a22d6c000 close(3) = 0 access("/etc/ld.so.nohwcap", F_OK) = -1 ENOENT (No such file or directory) open("/lib/x86_64-linux-gnu/libc.so.6", O_RDONLY|O_CLOEXEC) = 3 read(3, "\177ELF\2\1\1\3\0\0\0\0\0\0\0\0\3\0>\0\1\0\0\0P\t\2\0\0\0\0\0"..., 832) = 832 fstat(3, {st_mode=S_IFREG|0755, st_size=1868984, ...}) = 0 mmap(NULL, 4096, PROT_READ|PROT_WRITE, MAP_PRIVATE|MAP_ANONYMOUS, -1, 0) = 0x7f1a233c7000 mmap(NULL, 3971488, PROT_READ|PROT_EXEC, MAP_PRIVATE|MAP_DENYWRITE, 3, 0) = 0x7f1a22789000 mprotect(0x7f1a22949000, 2097152, PROT_NONE) = 0 mmap(0x7f1a22b49000, 24576, PROT_READ|PROT_WRITE, MAP_PRIVATE|MAP_FIXED|MAP_DENYWRITE, 3, 0x1c0000) = 0x7f1a22b49000 mmap(0x7f1a22b4f000, 14752, PROT_READ|PROT_WRITE, MAP_PRIVATE|MAP_FIXED|MAP_ANONYMOUS, -1, 0) = 0x7f1a22b4f000 close(3) = 0 access("/etc/ld.so.nohwcap", F_OK) = -1 ENOENT (No such file or directory) open("/lib/x86_64-linux-gnu/librt.so.1", O_RDONLY|O_CLOEXEC) = 3 read(3, "\177ELF\2\1\1\0\0\0\0\0\0\0\0\0\3\0>\0\1\0\0\0\0!\0\0\0\0\0\0"..., 832) = 832 fstat(3, {st_mode=S_IFREG|0644, st_size=31712, ...}) = 0 mmap(NULL, 2128832, PROT_READ|PROT_EXEC, MAP_PRIVATE|MAP_DENYWRITE, 3, 0) = 0x7f1a22581000 mprotect(0x7f1a22588000, 2093056, PROT_NONE) = 0 mmap(0x7f1a22787000, 8192, PROT_READ|PROT_WRITE, MAP_PRIVATE|MAP_FIXED|MAP_DENYWRITE, 3, 0x6000) = 0x7f1a22787000 close(3) = 0 access("/etc/ld.so.nohwcap", F_OK) = -1 ENOENT (No such file or directory) open("/lib/x86_64-linux-gnu/libdl.so.2", O_RDONLY|O_CLOEXEC) = 3 read(3, "\177ELF\2\1\1\0\0\0\0\0\0\0\0\0\3\0>\0\1\0\0\0\240\r\0\0\0\0\0\0"..., 832) = 832 fstat(3, {st_mode=S_IFREG|0644, st_size=14608, ...}) = 0 mmap(NULL, 2109680, PROT_READ|PROT_EXEC, MAP_PRIVATE|MAP_DENYWRITE, 3, 0) = 0x7f1a2237d000 mprotect(0x7f1a22380000, 2093056, PROT_NONE) = 0 mmap(0x7f1a2257f000, 8192, PROT_READ|PROT_WRITE, MAP_PRIVATE|MAP_FIXED|MAP_DENYWRITE, 3, 0x2000) = 0x7f1a2257f000 close(3) = 0 access("/etc/ld.so.nohwcap", F_OK) = -1 ENOENT (No such file or directory) open("/usr/lib/x86_64-linux-gnu/libgnutls.so.30", O_RDONLY|O_CLOEXEC) = 3 read(3, "\177ELF\2\1\1\0\0\0\0\0\0\0\0\0\3\0>\0\1\0\0\0\300R\2\0\0\0\0\0"..., 832) = 832 fstat(3, {st_mode=S_IFREG|0644, st_size=1239440, ...}) = 0 mmap(NULL, 4096, PROT_READ|PROT_WRITE, MAP_PRIVATE|MAP_ANONYMOUS, -1, 0) = 0x7f1a233c6000 mmap(NULL, 3338624, PROT_READ|PROT_EXEC, MAP_PRIVATE|MAP_DENYWRITE, 3, 0) = 0x7f1a2204d000 mprotect(0x7f1a22170000, 2093056, PROT_NONE) = 0 mmap(0x7f1a2236f000, 53248, PROT_READ|PROT_WRITE, MAP_PRIVATE|MAP_FIXED|MAP_DENYWRITE, 3, 0x122000) = 0x7f1a2236f000 mmap(0x7f1a2237c000, 384, PROT_READ|PROT_WRITE, MAP_PRIVATE|MAP_FIXED|MAP_ANONYMOUS, -1, 0) = 0x7f1a2237c000 close(3) = 0 access("/etc/ld.so.nohwcap", F_OK) = -1 ENOENT (No such file or directory) open("/lib/x86_64-linux-gnu/libgcrypt.so.20", O_RDONLY|O_CLOEXEC) = 3 read(3, "\177ELF\2\1\1\0\0\0\0\0\0\0\0\0\3\0>\0\1\0\0\0\0\215\0\0\0\0\0\0"..., 832) = 832 fstat(3, {st_mode=S_IFREG|0644, st_size=919168, ...}) = 0 mmap(NULL, 3015360, PROT_READ|PROT_EXEC, MAP_PRIVATE|MAP_DENYWRITE, 3, 0) = 0x7f1a21d6c000 mprotect(0x7f1a21e44000, 2093056, PROT_NONE) = 0 mmap(0x7f1a22043000, 36864, PROT_READ|PROT_WRITE, MAP_PRIVATE|MAP_FIXED|MAP_DENYWRITE, 3, 0xd7000) = 0x7f1a22043000 mmap(0x7f1a2204c000, 704, PROT_READ|PROT_WRITE, MAP_PRIVATE|MAP_FIXED|MAP_ANONYMOUS, -1, 0) = 0x7f1a2204c000 close(3) = 0 access("/etc/ld.so.nohwcap", F_OK) = -1 ENOENT (No such file or directory) open("/lib/x86_64-linux-gnu/libz.so.1", O_RDONLY|O_CLOEXEC) = 3 read(3, "\177ELF\2\1\1\0\0\0\0\0\0\0\0\0\3\0>\0\1\0\0\0\260\35\0\0\0\0\0\0"..., 832) = 832 fstat(3, {st_mode=S_IFREG|0644, st_size=104864, ...}) = 0 mmap(NULL, 2199848, PROT_READ|PROT_EXEC, MAP_PRIVATE|MAP_DENYWRITE, 3, 0) = 0x7f1a21b52000 mprotect(0x7f1a21b6b000, 2093056, PROT_NONE) = 0 mmap(0x7f1a21d6a000, 8192, PROT_READ|PROT_WRITE, MAP_PRIVATE|MAP_FIXED|MAP_DENYWRITE, 3, 0x18000) = 0x7f1a21d6a000 close(3) = 0 access("/etc/ld.so.nohwcap", F_OK) = -1 ENOENT (No such file or directory) open("/usr/lib/x86_64-linux-gnu/libp11-kit.so.0", O_RDONLY|O_CLOEXEC) = 3 read(3, "\177ELF\2\1\1\0\0\0\0\0\0\0\0\0\3\0>\0\1\0\0\0p\24\1\0\0\0\0\0"..., 832) = 832 fstat(3, {st_mode=S_IFREG|0644, st_size=408472, ...}) = 0 mmap(NULL, 4096, PROT_READ|PROT_WRITE, MAP_PRIVATE|MAP_ANONYMOUS, -1, 0) = 0x7f1a233c5000 mmap(NULL, 2504592, PROT_READ|PROT_EXEC, MAP_PRIVATE|MAP_DENYWRITE, 3, 0) = 0x7f1a218ee000 mprotect(0x7f1a21947000, 2093056, PROT_NONE) = 0 mmap(0x7f1a21b46000, 49152, PROT_READ|PROT_WRITE, MAP_PRIVATE|MAP_FIXED|MAP_DENYWRITE, 3, 0x58000) = 0x7f1a21b46000 close(3) = 0 access("/etc/ld.so.nohwcap", F_OK) = -1 ENOENT (No such file or directory) open("/usr/lib/x86_64-linux-gnu/libidn.so.11", O_RDONLY|O_CLOEXEC) = 3 read(3, "\177ELF\2\1\1\0\0\0\0\0\0\0\0\0\3\0>\0\1\0\0\0p+\0\0\0\0\0\0"..., 832) = 832 fstat(3, {st_mode=S_IFREG|0644, st_size=207208, ...}) = 0 mmap(NULL, 2302192, PROT_READ|PROT_EXEC, MAP_PRIVATE|MAP_DENYWRITE, 3, 0) = 0x7f1a216bb000 mprotect(0x7f1a216ec000, 2097152, PROT_NONE) = 0 mmap(0x7f1a218ec000, 8192, PROT_READ|PROT_WRITE, MAP_PRIVATE|MAP_FIXED|MAP_DENYWRITE, 3, 0x31000) = 0x7f1a218ec000 close(3) = 0 access("/etc/ld.so.nohwcap", F_OK) = -1 ENOENT (No such file or directory) open("/usr/lib/x86_64-linux-gnu/libtasn1.so.6", O_RDONLY|O_CLOEXEC) = 3 read(3, "\177ELF\2\1\1\0\0\0\0\0\0\0\0\0\3\0>\0\1\0\0\0\340)\0\0\0\0\0\0"..., 832) = 832 fstat(3, {st_mode=S_IFREG|0644, st_size=76192, ...}) = 0 mmap(NULL, 2171912, PROT_READ|PROT_EXEC, MAP_PRIVATE|MAP_DENYWRITE, 3, 0) = 0x7f1a214a8000 mprotect(0x7f1a214b9000, 2097152, PROT_NONE) = 0 mmap(0x7f1a216b9000, 8192, PROT_READ|PROT_WRITE, MAP_PRIVATE|MAP_FIXED|MAP_DENYWRITE, 3, 0x11000) = 0x7f1a216b9000 close(3) = 0 access("/etc/ld.so.nohwcap", F_OK) = -1 ENOENT (No such file or directory) open("/usr/lib/x86_64-linux-gnu/libnettle.so.6", O_RDONLY|O_CLOEXEC) = 3 read(3, "\177ELF\2\1\1\0\0\0\0\0\0\0\0\0\3\0>\0\1\0\0\0~\0\0\0\0\0\0"..., 832) = 832
fstat(3, {st_mode=S_IFREG|0644, st_size=219336, ...}) = 0
mmap(NULL, 4096, PROT_READ|PROT_WRITE, MAP_PRIVATE|MAP_ANONYMOUS, -1, 0) = 0x7f1a233c4000
mmap(NULL, 2314384, PROT_READ|PROT_EXEC, MAP_PRIVATE|MAP_DENYWRITE, 3, 0) = 0x7f1a21272000
mprotect(0x7f1a212a6000, 2093056, PROT_NONE) = 0
mmap(0x7f1a214a5000, 12288, PROT_READ|PROT_WRITE, MAP_PRIVATE|MAP_FIXED|MAP_DENYWRITE, 3, 0x33000) = 0x7f1a214a5000
close(3) = 0
access("/etc/ld.so.nohwcap", F_OK) = -1 ENOENT (No such file or directory)
open("/usr/lib/x86_64-linux-gnu/libhogweed.so.4", O_RDONLY|O_CLOEXEC) = 3
read(3, "\177ELF\2\1\1\0\0\0\0\0\0\0\0\0\3\0>\0\1\0\0\0\340e\0\0\0\0\0\0"..., 832) = 832
fstat(3, {st_mode=S_IFREG|0644, st_size=207640, ...}) = 0
mmap(NULL, 2302656, PROT_READ|PROT_EXEC, MAP_PRIVATE|MAP_DENYWRITE, 3, 0) = 0x7f1a2103f000
mprotect(0x7f1a21071000, 2093056, PROT_NONE) = 0
mmap(0x7f1a21270000, 8192, PROT_READ|PROT_WRITE, MAP_PRIVATE|MAP_FIXED|MAP_DENYWRITE, 3, 0x31000) = 0x7f1a21270000
close(3) = 0
access("/etc/ld.so.nohwcap", F_OK) = -1 ENOENT (No such file or directory)
open("/usr/lib/x86_64-linux-gnu/libgmp.so.10", O_RDONLY|O_CLOEXEC) = 3
read(3, "\177ELF\2\1\1\0\0\0\0\0\0\0\0\0\3\0>\0\1\0\0\0\300\223\0\0\0\0\0\0"..., 832) = 832
fstat(3, {st_mode=S_IFREG|0644, st_size=522664, ...}) = 0
mmap(NULL, 2617792, PROT_READ|PROT_EXEC, MAP_PRIVATE|MAP_DENYWRITE, 3, 0) = 0x7f1a20dbf000
mprotect(0x7f1a20e3e000, 2093056, PROT_NONE) = 0
mmap(0x7f1a2103d000, 8192, PROT_READ|PROT_WRITE, MAP_PRIVATE|MAP_FIXED|MAP_DENYWRITE, 3, 0x7e000) = 0x7f1a2103d000
close(3) = 0
access("/etc/ld.so.nohwcap", F_OK) = -1 ENOENT (No such file or directory)
open("/lib/x86_64-linux-gnu/libgpg-error.so.0", O_RDONLY|O_CLOEXEC) = 3
read(3, "\177ELF\2\1\1\0\0\0\0\0\0\0\0\0\3\0>\0\1\0\0\0\320(\0\0\0\0\0\0"..., 832) = 832
fstat(3, {st_mode=S_IFREG|0644, st_size=80496, ...}) = 0
mmap(NULL, 4096, PROT_READ|PROT_WRITE, MAP_PRIVATE|MAP_ANONYMOUS, -1, 0) = 0x7f1a233c3000
mmap(NULL, 2175544, PROT_READ|PROT_EXEC, MAP_PRIVATE|MAP_DENYWRITE, 3, 0) = 0x7f1a20bab000
mprotect(0x7f1a20bbd000, 2097152, PROT_NONE) = 0
mmap(0x7f1a20dbd000, 8192, PROT_READ|PROT_WRITE, MAP_PRIVATE|MAP_FIXED|MAP_DENYWRITE, 3, 0x12000) = 0x7f1a20dbd000
close(3) = 0
access("/etc/ld.so.nohwcap", F_OK) = -1 ENOENT (No such file or directory)
open("/usr/lib/x86_64-linux-gnu/libffi.so.6", O_RDONLY|O_CLOEXEC) = 3
read(3, "\177ELF\2\1\1\0\0\0\0\0\0\0\0\0\3\0>\0\1\0\0\0\360\27\0\0\0\0\0\0"..., 832) = 832
fstat(3, {st_mode=S_IFREG|0644, st_size=31104, ...}) = 0
mmap(NULL, 2127368, PROT_READ|PROT_EXEC, MAP_PRIVATE|MAP_DENYWRITE, 3, 0) = 0x7f1a209a3000
mprotect(0x7f1a209aa000, 2093056, PROT_NONE) = 0
mmap(0x7f1a20ba9000, 8192, PROT_READ|PROT_WRITE, MAP_PRIVATE|MAP_FIXED|MAP_DENYWRITE, 3, 0x6000) = 0x7f1a20ba9000
close(3) = 0
mmap(NULL, 4096, PROT_READ|PROT_WRITE, MAP_PRIVATE|MAP_ANONYMOUS, -1, 0) = 0x7f1a233c2000
mmap(NULL, 4096, PROT_READ|PROT_WRITE, MAP_PRIVATE|MAP_ANONYMOUS, -1, 0) = 0x7f1a233c1000
mmap(NULL, 8192, PROT_READ|PROT_WRITE, MAP_PRIVATE|MAP_ANONYMOUS, -1, 0) = 0x7f1a233bf000
arch_prctl(ARCH_SET_FS, 0x7f1a233bf740) = 0
mprotect(0x7f1a22b49000, 16384, PROT_READ) = 0
mprotect(0x7f1a20ba9000, 4096, PROT_READ) = 0
mprotect(0x7f1a20dbd000, 4096, PROT_READ) = 0
mprotect(0x7f1a2103d000, 4096, PROT_READ) = 0
mprotect(0x7f1a214a5000, 8192, PROT_READ) = 0
mprotect(0x7f1a21270000, 4096, PROT_READ) = 0
mprotect(0x7f1a216b9000, 4096, PROT_READ) = 0
mprotect(0x7f1a218ec000, 4096, PROT_READ) = 0
mprotect(0x7f1a22d6a000, 4096, PROT_READ) = 0
mprotect(0x7f1a2257f000, 4096, PROT_READ) = 0
mprotect(0x7f1a21b46000, 40960, PROT_READ) = 0
mprotect(0x7f1a21d6a000, 4096, PROT_READ) = 0
mprotect(0x7f1a22043000, 4096, PROT_READ) = 0
mprotect(0x7f1a2236f000, 45056, PROT_READ) = 0
mprotect(0x7f1a22787000, 4096, PROT_READ) = 0
mprotect(0x7f1a22f86000, 4096, PROT_READ) = 0
mprotect(0x7f1a231a9000, 4096, PROT_READ) = 0
mprotect(0x778000, 28672, PROT_READ) = 0
mprotect(0x7f1a233d0000, 4096, PROT_READ) = 0
munmap(0x7f1a233c9000, 26155) = 0
set_tid_address(0x7f1a233bfa10) = 15573
set_robust_list(0x7f1a233bfa20, 24) = 0
rt_sigaction(SIGRTMIN, {0x7f1a22b58b50, [], SA_RESTORER|SA_SIGINFO, 0x7f1a22b64390}, NULL, 8) = 0
rt_sigaction(SIGRT_1, {0x7f1a22b58be0, [], SA_RESTORER|SA_RESTART|SA_SIGINFO, 0x7f1a22b64390}, NULL, 8) = 0
rt_sigprocmask(SIG_UNBLOCK, [RTMIN RT_1], NULL, 8) = 0
getrlimit(RLIMIT_STACK, {rlim_cur=81921024, rlim_max=RLIM64_INFINITY}) = 0
brk(NULL) = 0x14dc000
brk(0x14fd000) = 0x14fd000
futex(0x7f1a21b51740, FUTEX_WAKE_PRIVATE, 2147483647) = 0
open("/dev/urandom", O_RDONLY) = 3
fcntl(3, F_GETFD) = 0
fcntl(3, F_SETFD, FD_CLOEXEC) = 0
fstat(3, {st_mode=S_IFCHR|0666, st_rdev=makedev(1, 9), ...}) = 0
getrusage(0x1 /* RUSAGE_??? /, {ru_utime={0, 0}, ru_stime={0, 8000}, ...}) = 0
read(3, "+\307ExH\312\354\252\365\317\241:,\253\370\307\372\306$\367`\225\274P(7\267?\2525?Q", 32) = 32
read(3, "\211lX\367\25\254\16\312\323\2\265^h\31\3774^\fC\210\202/\330 \303\255PW6<s\341", 32) = 32
read(3, "g\245js\224\20\237\254", 8) = 8
access("/etc/gcrypt/fips_enabled", F_OK) = -1 ENOENT (No such file or directory)
open("/proc/sys/crypto/fips_enabled", O_RDONLY) = -1 ENOENT (No such file or directory)
open("/etc/gcrypt/hwf.deny", O_RDONLY) = -1 ENOENT (No such file or directory)
fstat(3, {st_mode=S_IFCHR|0666, st_rdev=makedev(1, 9), ...}) = 0
futex(0x78106c, FUTEX_WAKE_PRIVATE, 2147483647) = 0
futex(0x781078, FUTEX_WAKE_PRIVATE, 2147483647) = 0
brk(0x152d000) = 0x152d000
readlink("/proc/self/exe", "/opt/cc/xmrigCCServer", 519) = 21
readlink("/proc/self/exe", "/opt/cc/xmrigCCServer", 519) = 21
pipe2([4, 5], O_CLOEXEC) = 0
write(5, "", 1) = 1
futex(0x7f1a231aaad0, FUTEX_WAKE_PRIVATE, 2147483647) = 0
clock_getres(CLOCK_MONOTONIC_COARSE, {0, 4000000}) = 0
epoll_create1(EPOLL_CLOEXEC) = 6
pipe2([7, 8], O_NONBLOCK|O_CLOEXEC) = 0
eventfd2(0, EFD_CLOEXEC|EFD_NONBLOCK) = 9
open("/opt/cc/config_cc.json", O_RDONLY|O_CLOEXEC) = 10
fcntl(10, F_GETFL) = 0x8000 (flags O_RDONLY|O_LARGEFILE)
fstat(10, {st_mode=S_IFREG|0644, st_size=969, ...}) = 0
read(10, "{\n "background": false, "..., 8192) = 969
read(10, "", 4096) = 0
close(10) = 0
ioctl(1, TCGETS, {B38400 opost isig icanon echo ...}) = 0
open("/dev/tty", O_RDWR|O_CLOEXEC) = 10
dup3(10, 1, O_CLOEXEC) = 1
open("/dev/null", O_RDONLY|O_CLOEXEC) = 11
ioctl(10, FIONBIO, [1]) = 0
ioctl(0, TCGETS, {B38400 opost isig icanon echo ...}) = 0
open("/dev/tty", O_RDWR|O_CLOEXEC) = 12
dup3(12, 0, O_CLOEXEC) = 0
ioctl(12, FIONBIO, [1]) = 0
ioctl(12, TCGETS, {B38400 opost isig icanon echo ...}) = 0
ioctl(12, TCGETS, {B38400 opost isig icanon echo ...}) = 0
ioctl(12, SNDCTL_TMR_STOP or TCSETSW, {B38400 opost -isig -icanon -echo ...}) = 0
ioctl(12, TCGETS, {B38400 opost -isig -icanon -echo ...}) = 0
open("cc_log", O_WRONLY|O_CREAT|O_APPEND|O_CLOEXEC, 0644) = 13
rt_sigprocmask(SIG_SETMASK, ~[RTMIN RT_1], [], 8) = 0
read(4, "", 1) = 1
rt_sigaction(SIGHUP, {0x7f1a22f992c0, ~[RTMIN RT_1], SA_RESTORER, 0x7f1a22b64390}, NULL, 8) = 0
write(5, "", 1) = 1
rt_sigprocmask(SIG_SETMASK, [], NULL, 8) = 0
rt_sigprocmask(SIG_SETMASK, ~[RTMIN RT_1], [], 8) = 0
read(4, "", 1) = 1
rt_sigaction(SIGHUP, {SIG_DFL, [], SA_RESTORER, 0x7f1a22b64390}, NULL, 8) = 0
write(5, "", 1) = 1
rt_sigprocmask(SIG_SETMASK, [], NULL, 8) = 0
rt_sigprocmask(SIG_SETMASK, ~[RTMIN RT_1], [], 8) = 0
read(4, "", 1) = 1
rt_sigaction(SIGTERM, {0x7f1a22f992c0, ~[RTMIN RT_1], SA_RESTORER, 0x7f1a22b64390}, NULL, 8) = 0
write(5, "", 1) = 1
rt_sigprocmask(SIG_SETMASK, [], NULL, 8) = 0
rt_sigprocmask(SIG_SETMASK, ~[RTMIN RT_1], [], 8) = 0
read(4, "", 1) = 1
rt_sigaction(SIGTERM, {SIG_DFL, [], SA_RESTORER, 0x7f1a22b64390}, NULL, 8) = 0
write(5, "", 1) = 1
rt_sigprocmask(SIG_SETMASK, [], NULL, 8) = 0
rt_sigprocmask(SIG_SETMASK, ~[RTMIN RT_1], [], 8) = 0
read(4, "", 1) = 1
rt_sigaction(SIGINT, {0x7f1a22f992c0, ~[RTMIN RT_1], SA_RESTORER, 0x7f1a22b64390}, NULL, 8) = 0
write(5, "", 1) = 1
rt_sigprocmask(SIG_SETMASK, [], NULL, 8) = 0
ioctl(1, TCGETS, {B38400 opost -isig -icanon -echo ...}) = 0
write(10, " * VERSIONS: XMRigCC/1.4.0 ("..., 76) = 76
open("/etc/localtime", O_RDONLY|O_CLOEXEC) = 14
fstat(14, {st_mode=S_IFREG|0644, st_size=2384, ...}) = 0
fstat(14, {st_mode=S_IFREG|0644, st_size=2384, ...}) = 0
read(14, "TZif2\0\0\0\0\0\0\0\0\0\0\0\0\0\0\0\0\0\0\t\0\0\0\t\0\0\0\0"..., 4096) = 2384
lseek(14, -1506, SEEK_CUR) = 878
read(14, "TZif2\0\0\0\0\0\0\0\0\0\0\0\0\0\0\0\0\0\0\n\0\0\0\n\0\0\0\0"..., 4096) = 1506
close(14) = 0
mmap(NULL, 8392704, PROT_READ|PROT_WRITE, MAP_PRIVATE|MAP_ANONYMOUS|MAP_STACK, -1, 0) = 0x7f1a201a2000
mprotect(0x7f1a201a2000, 4096, PROT_NONE) = 0
clone(child_stack=0x7f1a209a1fb0, flags=CLONE_VM|CLONE_FS|CLONE_FILES|CLONE_SIGHAND|CLONE_THREAD|CLONE_SYSVSEM|CLONE_SETTLS|CLONE_PARENT_SETTID|CLONE_CHILD_CLEARTID, parent_tidptr=0x7f1a209a29d0, tls=0x7f1a209a2700, child_tidptr=0x7f1a209a29d0) = 15574
mmap(NULL, 8392704, PROT_READ|PROT_WRITE, MAP_PRIVATE|MAP_ANONYMOUS|MAP_STACK, -1, 0) = 0x7f1a1f9a1000
mprotect(0x7f1a1f9a1000, 4096, PROT_NONE) = 0
clone(child_stack=0x7f1a201a0fb0, flags=CLONE_VM|CLONE_FS|CLONE_FILES|CLONE_SIGHAND|CLONE_THREAD|CLONE_SYSVSEM|CLONE_SETTLS|CLONE_PARENT_SETTID|CLONE_CHILD_CLEARTID, parent_tidptr=0x7f1a201a19d0, tls=0x7f1a201a1700, child_tidptr=0x7f1a201a19d0) = 15575
mmap(NULL, 8392704, PROT_READ|PROT_WRITE, MAP_PRIVATE|MAP_ANONYMOUS|MAP_STACK, -1, 0) = 0x7f1a1f1a0000
mprotect(0x7f1a1f1a0000, 4096, PROT_NONE) = 0
clone(child_stack=0x7f1a1f99ffb0, flags=CLONE_VM|CLONE_FS|CLONE_FILES|CLONE_SIGHAND|CLONE_THREAD|CLONE_SYSVSEM|CLONE_SETTLS|CLONE_PARENT_SETTID|CLONE_CHILD_CLEARTID, parent_tidptr=0x7f1a1f9a09d0, tls=0x7f1a1f9a0700, child_tidptr=0x7f1a1f9a09d0) = 15576
mmap(NULL, 8392704, PROT_READ|PROT_WRITE, MAP_PRIVATE|MAP_ANONYMOUS|MAP_STACK, -1, 0) = 0x7f1a1e99f000
mprotect(0x7f1a1e99f000, 4096, PROT_NONE) = 0
clone(child_stack=0x7f1a1f19efb0, flags=CLONE_VM|CLONE_FS|CLONE_FILES|CLONE_SIGHAND|CLONE_THREAD|CLONE_SYSVSEM|CLONE_SETTLS|CLONE_PARENT_SETTID|CLONE_CHILD_CLEARTID, parent_tidptr=0x7f1a1f19f9d0, tls=0x7f1a1f19f700, child_tidptr=0x7f1a1f19f9d0) = 15577
futex(0x7f1a231aa710, FUTEX_WAKE_PRIVATE, 2147483647) = 0
futex(0x7f1a231aa6e4, FUTEX_WAKE_OP_PRIVATE, 1, 1, 0x7f1a231aa6e0, {FUTEX_OP_SET, 0, FUTEX_OP_CMP_GT, 1}) = 1
futex(0x7f1a231aa6a0, FUTEX_WAKE_PRIVATE, 1) = 1
ioctl(1, TCGETS, {B38400 opost -isig -icanon -echo ...}) = 0
write(10, " * COMMANDS: 'q' Quit\n", 26) = 26
futex(0x7f1a231aa6e4, FUTEX_WAKE_OP_PRIVATE, 1, 1, 0x7f1a231aa6e0, {FUTEX_OP_SET, 0, FUTEX_OP_CMP_GT, 1}) = 1
futex(0x7f1a231aa6a0, FUTEX_WAKE_PRIVATE, 1) = 1
socket(PF_INET, SOCK_STREAM|SOCK_CLOEXEC, IPPROTO_IP) = 14
setsockopt(14, SOL_SOCKET, SO_REUSEADDR, [1], 4) = 0
bind(14, {sa_family=AF_INET, sin_port=htons(80), sin_addr=inet_addr("0.0.0.0")}, 16) = 0
listen(14, 32) = 0
mmap(NULL, 8392704, PROT_READ|PROT_WRITE, MAP_PRIVATE|MAP_ANONYMOUS|MAP_STACK, -1, 0) = 0x7f1a1e19e000
mprotect(0x7f1a1e19e000, 4096, PROT_NONE) = 0
clone(child_stack=0x7f1a1e99dfb0, flags=CLONE_VM|CLONE_FS|CLONE_FILES|CLONE_SIGHAND|CLONE_THREAD|CLONE_SYSVSEM|CLONE_SETTLS|CLONE_PARENT_SETTID|CLONE_CHILD_CLEARTID, parent_tidptr=0x7f1a1e99e9d0, tls=0x7f1a1e99e700, child_tidptr=0x7f1a1e99e9d0) = 15578
open("/proc/self/task/15578/comm", O_RDWR) = 15
write(15, "libmicrohttpd", 13) = 13
close(15) = 0
ioctl(1, TCGETS, {B38400 opost -isig -icanon -echo ...}) = 0
write(10, "[2018-02-16 09:00:13] XMRigCC Se"..., 57) = 57
futex(0x7f1a231aa6e4, FUTEX_WAKE_OP_PRIVATE, 1, 1, 0x7f1a231aa6e0, {FUTEX_OP_SET, 0, FUTEX_OP_CMP_GT, 1}) = 1
futex(0x7f1a231aa6a0, FUTEX_WAKE_PRIVATE, 1) = 1
epoll_ctl(6, EPOLL_CTL_ADD, 7, {EPOLLIN, {u32=7, u64=7}}) = 0
epoll_ctl(6, EPOLL_CTL_ADD, 9, {EPOLLIN, {u32=9, u64=9}}) = 0
epoll_ctl(6, EPOLL_CTL_ADD, 12, {EPOLLIN, {u32=12, u64=12}}) = 0
epoll_wait(6, [{EPOLLIN, {u32=9, u64=9}}], 1024, -1) = 1
read(9, "\1\0\0\0\0\0\0\0", 1024) = 8
epoll_wait(6, [{EPOLLIN, {u32=9, u64=9}}], 1024, -1) = 1
read(9, "\1\0\0\0\0\0\0\0", 1024) = 8
epoll_wait(6, [{EPOLLIN, {u32=9, u64=9}}], 1024, -1) = 1
read(9, "\1\0\0\0\0\0\0\0", 1024) = 8
epoll_wait(6, [{EPOLLIN, {u32=9, u64=9}}], 1024, -1) = 1
read(9, "\1\0\0\0\0\0\0\0", 1024) = 8
epoll_wait(6, [{EPOLLIN, {u32=9, u64=9}}], 1024, -1) = 1
read(9, "\1\0\0\0\0\0\0\0", 1024) = 8
epoll_wait(6, [{EPOLLIN, {u32=9, u64=9}}], 1024, -1) = 1
read(9, "\1\0\0\0\0\0\0\0", 1024) = 8
epoll_wait(6, [{EPOLLIN, {u32=9, u64=9}}], 1024, -1) = 1
read(9, "\1\0\0\0\0\0\0\0", 1024) = 8
epoll_wait(6, [{EPOLLIN, {u32=9, u64=9}}], 1024, -1) = 1
read(9, "\1\0\0\0\0\0\0\0", 1024) = 8
epoll_wait(6, [{EPOLLIN, {u32=9, u64=9}}], 1024, -1) = 1
read(9, "\1\0\0\0\0\0\0\0", 1024) = 8
epoll_wait(6, [{EPOLLIN, {u32=9, u64=9}}], 1024, -1) = 1
read(9, "\1\0\0\0\0\0\0\0", 1024) = 8
epoll_wait(6, [{EPOLLIN, {u32=9, u64=9}}], 1024, -1) = 1
read(9, "\1\0\0\0\0\0\0\0", 1024) = 8
epoll_wait(6, [{EPOLLIN, {u32=9, u64=9}}], 1024, -1) = 1
read(9, "\1\0\0\0\0\0\0\0", 1024) = 8
epoll_wait(6, [{EPOLLIN, {u32=9, u64=9}}], 1024, -1) = 1
read(9, "\1\0\0\0\0\0\0\0", 1024) = 8
epoll_wait(6, [{EPOLLIN, {u32=9, u64=9}}], 1024, -1) = 1
read(9, "\1\0\0\0\0\0\0\0", 1024) = 8
epoll_wait(6, [{EPOLLIN, {u32=9, u64=9}}], 1024, -1) = 1
read(9, "\1\0\0\0\0\0\0\0", 1024) = 8
epoll_wait(6, [{EPOLLIN, {u32=9, u64=9}}], 1024, -1) = 1
read(9, "\1\0\0\0\0\0\0\0", 1024) = 8
epoll_wait(6, [{EPOLLIN, {u32=9, u64=9}}], 1024, -1) = 1
read(9, "\1\0\0\0\0\0\0\0", 1024) = 8
epoll_wait(6, [{EPOLLIN, {u32=9, u64=9}}], 1024, -1) = 1
read(9, "\1\0\0\0\0\0\0\0", 1024) = 8
epoll_wait(6, [{EPOLLIN, {u32=9, u64=9}}], 1024, -1) = 1
read(9, "\1\0\0\0\0\0\0\0", 1024) = 8
epoll_wait(6, [{EPOLLIN, {u32=9, u64=9}}], 1024, -1) = 1
read(9, "\1\0\0\0\0\0\0\0", 1024) = 8
epoll_wait(6, [{EPOLLIN, {u32=9, u64=9}}], 1024, -1) = 1
read(9, "\1\0\0\0\0\0\0\0", 1024) = 8
epoll_wait(6, [{EPOLLIN, {u32=9, u64=9}}], 1024, -1) = 1
read(9, "\1\0\0\0\0\0\0\0", 1024) = 8
epoll_wait(6, [{EPOLLIN, {u32=9, u64=9}}], 1024, -1) = 1
read(9, "\1\0\0\0\0\0\0\0", 1024) = 8
epoll_wait(6, [{EPOLLIN, {u32=9, u64=9}}], 1024, -1) = 1
read(9, "\1\0\0\0\0\0\0\0", 1024) = 8
epoll_wait(6, [{EPOLLIN, {u32=9, u64=9}}], 1024, -1) = 1
read(9, "\1\0\0\0\0\0\0\0", 1024) = 8
epoll_wait(6, [{EPOLLIN, {u32=9, u64=9}}], 1024, -1) = 1
read(9, "\1\0\0\0\0\0\0\0", 1024) = 8
epoll_wait(6, [{EPOLLIN, {u32=9, u64=9}}], 1024, -1) = 1
read(9, "\1\0\0\0\0\0\0\0", 1024) = 8
epoll_wait(6, [{EPOLLIN, {u32=9, u64=9}}], 1024, -1) = 1
read(9, "\1\0\0\0\0\0\0\0", 1024) = 8
epoll_wait(6, [{EPOLLIN, {u32=9, u64=9}}], 1024, -1) = 1
read(9, "\1\0\0\0\0\0\0\0", 1024) = 8
epoll_wait(6, [{EPOLLIN, {u32=9, u64=9}}], 1024, -1) = 1
read(9, "\1\0\0\0\0\0\0\0", 1024) = 8
epoll_wait(6, [{EPOLLIN, {u32=9, u64=9}}], 1024, -1) = 1
read(9, "\1\0\0\0\0\0\0\0", 1024) = 8
epoll_wait(6, [{EPOLLIN, {u32=9, u64=9}}], 1024, -1) = 1
read(9, "\1\0\0\0\0\0\0\0", 1024) = 8
epoll_wait(6, [{EPOLLIN, {u32=9, u64=9}}], 1024, -1) = 1
read(9, "\1\0\0\0\0\0\0\0", 1024) = 8
epoll_wait(6, [{EPOLLIN, {u32=9, u64=9}}], 1024, -1) = 1
read(9, "\1\0\0\0\0\0\0\0", 1024) = 8
epoll_wait(6, [{EPOLLIN, {u32=9, u64=9}}], 1024, -1) = 1
read(9, "\1\0\0\0\0\0\0\0", 1024) = 8
epoll_wait(6, [{EPOLLIN, {u32=9, u64=9}}], 1024, -1) = 1
read(9, "\1\0\0\0\0\0\0\0", 1024) = 8
epoll_wait(6, [{EPOLLIN, {u32=9, u64=9}}], 1024, -1) = 1
read(9, "\1\0\0\0\0\0\0\0", 1024) = 8
epoll_wait(6, [{EPOLLIN, {u32=9, u64=9}}], 1024, -1) = 1
read(9, "\1\0\0\0\0\0\0\0", 1024) = 8
epoll_wait(6, [{EPOLLIN, {u32=9, u64=9}}], 1024, -1) = 1
read(9, "\1\0\0\0\0\0\0\0", 1024) = 8
epoll_wait(6, [{EPOLLIN, {u32=9, u64=9}}], 1024, -1) = 1
read(9, "\1\0\0\0\0\0\0\0", 1024) = 8
epoll_wait(6, [{EPOLLIN, {u32=9, u64=9}}], 1024, -1) = 1
read(9, "\1\0\0\0\0\0\0\0", 1024) = 8
epoll_wait(6, [{EPOLLIN, {u32=9, u64=9}}], 1024, -1) = 1
read(9, "\1\0\0\0\0\0\0\0", 1024) = 8
epoll_wait(6, [{EPOLLIN, {u32=9, u64=9}}], 1024, -1) = 1
read(9, "\1\0\0\0\0\0\0\0", 1024) = 8
epoll_wait(6, [{EPOLLIN, {u32=9, u64=9}}], 1024, -1) = 1
read(9, "\1\0\0\0\0\0\0\0", 1024) = 8
epoll_wait(6, [{EPOLLIN, {u32=9, u64=9}}], 1024, -1) = 1
read(9, "\1\0\0\0\0\0\0\0", 1024) = 8
epoll_wait(6, [{EPOLLIN, {u32=9, u64=9}}], 1024, -1) = 1
read(9, "\1\0\0\0\0\0\0\0", 1024) = 8
epoll_wait(6, [{EPOLLIN, {u32=9, u64=9}}], 1024, -1) = 1
read(9, "\1\0\0\0\0\0\0\0", 1024) = 8
epoll_wait(6, [{EPOLLIN, {u32=9, u64=9}}], 1024, -1) = 1
read(9, "\1\0\0\0\0\0\0\0", 1024) = 8
epoll_wait(6, [{EPOLLIN, {u32=9, u64=9}}], 1024, -1) = 1
read(9, "\1\0\0\0\0\0\0\0", 1024) = 8
epoll_wait(6, [{EPOLLIN, {u32=9, u64=9}}], 1024, -1) = 1
read(9, "\1\0\0\0\0\0\0\0", 1024) = 8
epoll_wait(6, [{EPOLLIN, {u32=9, u64=9}}], 1024, -1) = 1
read(9, "\1\0\0\0\0\0\0\0", 1024) = 8
epoll_wait(6, [{EPOLLIN, {u32=9, u64=9}}], 1024, -1) = 1
read(9, "\1\0\0\0\0\0\0\0", 1024) = 8
epoll_wait(6, [{EPOLLIN, {u32=9, u64=9}}], 1024, -1) = 1
read(9, "\1\0\0\0\0\0\0\0", 1024) = 8
epoll_wait(6, [{EPOLLIN, {u32=9, u64=9}}], 1024, -1) = 1
read(9, "\1\0\0\0\0\0\0\0", 1024) = 8
epoll_wait(6, [{EPOLLIN, {u32=9, u64=9}}], 1024, -1) = 1
read(9, "\1\0\0\0\0\0\0\0", 1024) = 8
epoll_wait(6, [{EPOLLIN, {u32=9, u64=9}}], 1024, -1) = 1
read(9, "\1\0\0\0\0\0\0\0", 1024) = 8
futex(0x7f1a18000020, FUTEX_WAIT_PRIVATE, 2, NULL) = -1 EAGAIN (Resource temporarily unavailable)
futex(0x7f1a18000020, FUTEX_WAKE_PRIVATE, 1) = 0
epoll_wait(6, [{EPOLLIN, {u32=9, u64=9}}], 1024, -1) = 1
read(9, "\1\0\0\0\0\0\0\0", 1024) = 8
epoll_wait(6, [{EPOLLIN, {u32=9, u64=9}}], 1024, -1) = 1
read(9, "\1\0\0\0\0\0\0\0", 1024) = 8
epoll_wait(6, [{EPOLLIN, {u32=9, u64=9}}], 1024, -1) = 1
read(9, "\1\0\0\0\0\0\0\0", 1024) = 8
futex(0x7f1a18000020, FUTEX_WAKE_PRIVATE, 1) = 0
epoll_wait(6, [{EPOLLIN, {u32=9, u64=9}}], 1024, -1) = 1
read(9, "\1\0\0\0\0\0\0\0", 1024) = 8
epoll_wait(6, [{EPOLLIN, {u32=9, u64=9}}], 1024, -1) = 1
read(9, "\1\0\0\0\0\0\0\0", 1024) = 8
epoll_wait(6, [{EPOLLIN, {u32=9, u64=9}}], 1024, -1) = 1
read(9, "\1\0\0\0\0\0\0\0", 1024) = 8
epoll_wait(6, [{EPOLLIN, {u32=9, u64=9}}], 1024, -1) = 1
read(9, "\1\0\0\0\0\0\0\0", 1024) = 8
epoll_wait(6, [{EPOLLIN, {u32=9, u64=9}}], 1024, -1) = 1
read(9, "\1\0\0\0\0\0\0\0", 1024) = 8
epoll_wait(6, [{EPOLLIN, {u32=9, u64=9}}], 1024, -1) = 1
read(9, "\1\0\0\0\0\0\0\0", 1024) = 8
epoll_wait(6, [{EPOLLIN, {u32=9, u64=9}}], 1024, -1) = 1
read(9, "\1\0\0\0\0\0\0\0", 1024) = 8
epoll_wait(6, [{EPOLLIN, {u32=9, u64=9}}], 1024, -1) = 1
read(9, "\1\0\0\0\0\0\0\0", 1024) = 8
epoll_wait(6, [{EPOLLIN, {u32=9, u64=9}}], 1024, -1) = 1
read(9, "\1\0\0\0\0\0\0\0", 1024) = 8
epoll_wait(6, [{EPOLLIN, {u32=9, u64=9}}], 1024, -1) = 1
read(9, "\1\0\0\0\0\0\0\0", 1024) = 8
epoll_wait(6, [{EPOLLIN, {u32=9, u64=9}}], 1024, -1) = 1
read(9, "\1\0\0\0\0\0\0\0", 1024) = 8
epoll_wait(6, [{EPOLLIN, {u32=9, u64=9}}], 1024, -1) = 1
read(9, "\1\0\0\0\0\0\0\0", 1024) = 8
epoll_wait(6, [{EPOLLIN, {u32=9, u64=9}}], 1024, -1) = 1
read(9, "\1\0\0\0\0\0\0\0", 1024) = 8
epoll_wait(6, [{EPOLLIN, {u32=9, u64=9}}], 1024, -1) = 1
read(9, "\1\0\0\0\0\0\0\0", 1024) = 8
epoll_wait(6, [{EPOLLIN, {u32=9, u64=9}}], 1024, -1) = 1
read(9, "\1\0\0\0\0\0\0\0", 1024) = 8
epoll_wait(6, [{EPOLLIN, {u32=9, u64=9}}], 1024, -1) = 1
read(9, "\1\0\0\0\0\0\0\0", 1024) = 8
epoll_wait(6, [{EPOLLIN, {u32=9, u64=9}}], 1024, -1) = 1
read(9, "\1\0\0\0\0\0\0\0", 1024) = 8
epoll_wait(6, [{EPOLLIN, {u32=9, u64=9}}], 1024, -1) = 1
read(9, "\1\0\0\0\0\0\0\0", 1024) = 8
epoll_wait(6, [{EPOLLIN, {u32=9, u64=9}}], 1024, -1) = 1
read(9, "\1\0\0\0\0\0\0\0", 1024) = 8
epoll_wait(6, [{EPOLLIN, {u32=9, u64=9}}], 1024, -1) = 1
read(9, "\1\0\0\0\0\0\0\0", 1024) = 8
epoll_wait(6, [{EPOLLIN, {u32=9, u64=9}}], 1024, -1) = 1
read(9, "\1\0\0\0\0\0\0\0", 1024) = 8
epoll_wait(6, [{EPOLLIN, {u32=9, u64=9}}], 1024, -1) = 1
read(9, "\1\0\0\0\0\0\0\0", 1024) = 8
epoll_wait(6, [{EPOLLIN, {u32=9, u64=9}}], 1024, -1) = 1
read(9, "\1\0\0\0\0\0\0\0", 1024) = 8
epoll_wait(6, [{EPOLLIN, {u32=9, u64=9}}], 1024, -1) = 1
read(9, "\1\0\0\0\0\0\0\0", 1024) = 8
epoll_wait(6, [{EPOLLIN, {u32=9, u64=9}}], 1024, -1) = 1
read(9, "\1\0\0\0\0\0\0\0", 1024) = 8
epoll_wait(6, [{EPOLLIN, {u32=9, u64=9}}], 1024, -1) = 1
read(9, "\1\0\0\0\0\0\0\0", 1024) = 8
epoll_wait(6, [{EPOLLIN, {u32=9, u64=9}}], 1024, -1) = 1
read(9, "\1\0\0\0\0\0\0\0", 1024) = 8
epoll_wait(6, [{EPOLLIN, {u32=9, u64=9}}], 1024, -1) = 1
read(9, "\1\0\0\0\0\0\0\0", 1024) = 8
epoll_wait(6, [{EPOLLIN, {u32=9, u64=9}}], 1024, -1) = 1
read(9, "\1\0\0\0\0\0\0\0", 1024) = 8
epoll_wait(6, [{EPOLLIN, {u32=9, u64=9}}], 1024, -1) = 1
read(9, "\1\0\0\0\0\0\0\0", 1024) = 8
epoll_wait(6, [{EPOLLIN, {u32=9, u64=9}}], 1024, -1) = 1
read(9, "\1\0\0\0\0\0\0\0", 1024) = 8
epoll_wait(6, [{EPOLLIN, {u32=9, u64=9}}], 1024, -1) = 1
read(9, "\1\0\0\0\0\0\0\0", 1024) = 8
epoll_wait(6, [{EPOLLIN, {u32=9, u64=9}}], 1024, -1) = 1
read(9, "\1\0\0\0\0\0\0\0", 1024) = 8
epoll_wait(6, [{EPOLLIN, {u32=9, u64=9}}], 1024, -1) = 1
read(9, "\1\0\0\0\0\0\0\0", 1024) = 8
epoll_wait(6, [{EPOLLIN, {u32=9, u64=9}}], 1024, -1) = 1
read(9, "\1\0\0\0\0\0\0\0", 1024) = 8
epoll_wait(6, [{EPOLLIN, {u32=9, u64=9}}], 1024, -1) = 1
read(9, "\1\0\0\0\0\0\0\0", 1024) = 8
epoll_wait(6, [{EPOLLIN, {u32=9, u64=9}}], 1024, -1) = 1
read(9, "\1\0\0\0\0\0\0\0", 1024) = 8
epoll_wait(6, [{EPOLLIN, {u32=9, u64=9}}], 1024, -1) = 1
read(9, "\1\0\0\0\0\0\0\0", 1024) = 8
epoll_wait(6, [{EPOLLIN, {u32=9, u64=9}}], 1024, -1) = 1
read(9, "\1\0\0\0\0\0\0\0", 1024) = 8
epoll_wait(6, [{EPOLLIN, {u32=9, u64=9}}], 1024, -1) = 1
read(9, "\1\0\0\0\0\0\0\0", 1024) = 8
epoll_wait(6, [{EPOLLIN, {u32=9, u64=9}}], 1024, -1) = 1
read(9, "\1\0\0\0\0\0\0\0", 1024) = 8
futex(0x7f1a18000020, FUTEX_WAIT_PRIVATE, 2, NULL) = -1 EAGAIN (Resource temporarily unavailable)
futex(0x7f1a18000020, FUTEX_WAKE_PRIVATE, 1) = 0
epoll_wait(6, [{EPOLLIN, {u32=9, u64=9}}], 1024, -1) = 1
read(9, "\1\0\0\0\0\0\0\0", 1024) = 8
epoll_wait(6, [{EPOLLIN, {u32=9, u64=9}}], 1024, -1) = 1
read(9, "\1\0\0\0\0\0\0\0", 1024) = 8
epoll_wait(6, [{EPOLLIN, {u32=9, u64=9}}], 1024, -1) = 1
read(9, "\1\0\0\0\0\0\0\0", 1024) = 8
epoll_wait(6, [{EPOLLIN, {u32=9, u64=9}}], 1024, -1) = 1
read(9, "\1\0\0\0\0\0\0\0", 1024) = 8
futex(0x7f1a18000020, FUTEX_WAIT_PRIVATE, 2, NULL) = -1 EAGAIN (Resource temporarily unavailable)
futex(0x7f1a18000020, FUTEX_WAKE_PRIVATE, 1) = 0
epoll_wait(6, [{EPOLLIN, {u32=9, u64=9}}], 1024, -1) = 1
read(9, "\1\0\0\0\0\0\0\0", 1024) = 8
epoll_wait(6, [{EPOLLIN, {u32=9, u64=9}}], 1024, -1) = 1
read(9, "\1\0\0\0\0\0\0\0", 1024) = 8
epoll_wait(6, [{EPOLLIN, {u32=9, u64=9}}], 1024, -1) = 1
read(9, "\1\0\0\0\0\0\0\0", 1024) = 8
epoll_wait(6, [{EPOLLIN, {u32=9, u64=9}}], 1024, -1) = 1
read(9, "\1\0\0\0\0\0\0\0", 1024) = 8
epoll_wait(6, [{EPOLLIN, {u32=9, u64=9}}], 1024, -1) = 1
read(9, "\1\0\0\0\0\0\0\0", 1024) = 8
epoll_wait(6, [{EPOLLIN, {u32=9, u64=9}}], 1024, -1) = 1
read(9, "\1\0\0\0\0\0\0\0", 1024) = 8
epoll_wait(6, [{EPOLLIN, {u32=9, u64=9}}], 1024, -1) = 1
read(9, "\1\0\0\0\0\0\0\0", 1024) = 8
epoll_wait(6, [{EPOLLIN, {u32=9, u64=9}}], 1024, -1) = 1
read(9, "\1\0\0\0\0\0\0\0", 1024) = 8
epoll_wait(6, [{EPOLLIN, {u32=9, u64=9}}], 1024, -1) = 1
read(9, "\1\0\0\0\0\0\0\0", 1024) = 8
epoll_wait(6, [{EPOLLIN, {u32=9, u64=9}}], 1024, -1) = 1
read(9, "\1\0\0\0\0\0\0\0", 1024) = 8
epoll_wait(6, [{EPOLLIN, {u32=9, u64=9}}], 1024, -1) = 1
read(9, "\1\0\0\0\0\0\0\0", 1024) = 8
epoll_wait(6, [{EPOLLIN, {u32=9, u64=9}}], 1024, -1) = 1
read(9, "\1\0\0\0\0\0\0\0", 1024) = 8
epoll_wait(6, [{EPOLLIN, {u32=9, u64=9}}], 1024, -1) = 1
read(9, "\1\0\0\0\0\0\0\0", 1024) = 8
epoll_wait(6, [{EPOLLIN, {u32=9, u64=9}}], 1024, -1) = 1
read(9, "\1\0\0\0\0\0\0\0", 1024) = 8
epoll_wait(6, [{EPOLLIN, {u32=9, u64=9}}], 1024, -1) = 1
read(9, "\1\0\0\0\0\0\0\0", 1024) = 8
epoll_wait(6, [{EPOLLIN, {u32=9, u64=9}}], 1024, -1) = 1
read(9, "\1\0\0\0\0\0\0\0", 1024) = 8
futex(0x7f1a18000020, FUTEX_WAKE_PRIVATE, 1) = 0
epoll_wait(6, [{EPOLLIN, {u32=9, u64=9}}], 1024, -1) = 1
read(9, "\1\0\0\0\0\0\0\0", 1024) = 8
epoll_wait(6, [{EPOLLIN, {u32=9, u64=9}}], 1024, -1) = 1
read(9, "\1\0\0\0\0\0\0\0", 1024) = 8
epoll_wait(6, [{EPOLLIN, {u32=9, u64=9}}], 1024, -1) = 1
read(9, "\1\0\0\0\0\0\0\0", 1024) = 8
epoll_wait(6, [{EPOLLIN, {u32=9, u64=9}}], 1024, -1) = 1
read(9, "\1\0\0\0\0\0\0\0", 1024) = 8
epoll_wait(6, [{EPOLLIN, {u32=9, u64=9}}], 1024, -1) = 1
read(9, "\1\0\0\0\0\0\0\0", 1024) = 8
futex(0x7f1a18000020, FUTEX_WAIT_PRIVATE, 2, NULL) = -1 EAGAIN (Resource temporarily unavailable)
futex(0x7f1a18000020, FUTEX_WAKE_PRIVATE, 1) = 0
epoll_wait(6, [{EPOLLIN, {u32=9, u64=9}}], 1024, -1) = 1
read(9, "\1\0\0\0\0\0\0\0", 1024) = 8
epoll_wait(6, [{EPOLLIN, {u32=9, u64=9}}], 1024, -1) = 1
read(9, "\1\0\0\0\0\0\0\0", 1024) = 8
epoll_wait(6, [{EPOLLIN, {u32=9, u64=9}}], 1024, -1) = 1
read(9, "\1\0\0\0\0\0\0\0", 1024) = 8
write(10, "[2018-02-16 09:00:27] Status fro"..., 52) = 52
--- SIGSEGV {si_signo=SIGSEGV, si_code=SEGV_MAPERR, si_addr=0x200009} ---
+++ killed by SIGSEGV (core dumped) +++

**Comment by mamkinminer** [comment]
>>"Hmm, does it happen immediately after start?
>>Even when only some miners are connected?"

Randomly. Sometime server might worked 10-15 minutes, sometime crashed immediatly

XMRigCCServer started from root, just command: ./XMRigCCServer
No problem with permissions, I check it


config:
    "background": false,                            // true to run the cc-server in the background (no console)
    "colors": true,                                 // false to disable colored output
    "log-file": "cc_log",                               // log all output to a file
    "syslog": false,                                // use system log for output messages
    "cc-server": {
        "port": 80,                               // port the CC Server will listens on
        "access-token": "sometoken",                 // access token for CC Clients (should be set!!!)
        "user": "someuser",                            // admin user for access CC Dashboard
        "pass": "somepass",                             // admin pass for access CC Dashboard
        "client-config-folder" : null,              // folder which contains the client-config files (null=current)
        "custom-dashboard" : "index.html"           // dashboard html file

**Comment by Bendr0id** [comment]
Possible to add me on telegram? @Bendr0id

Then I can help much faster

Am 16.02.2018 19:38 schrieb mamkinminer <notifications@github.com>:

"Hmm, does it happen immediately after start?
Even when only some miners are connected?"

Randomly. Sometime server might worked 10-15 minutes, sometime crashed immediatly

XMRigCCServer started from root, just command: ./XMRigCCServer
No problem with permissions, I check it

config:
"background": false, // true to run the cc-server in the background (no console)
"colors": true, // false to disable colored output
"log-file": "cc_log", // log all output to a file
"syslog": false, // use system log for output messages
"cc-server": {
"port": 80, // port the CC Server will listens on
"access-token": "sometoken", // access token for CC Clients (should be set!!!)
"user": "someuser", // admin user for access CC Dashboard
"pass": "somepass", // admin pass for access CC Dashboard
"client-config-folder" : null, // folder which contains the client-config files (null=current)
"custom-dashboard" : "index.html" // dashboard html file

**Comment by Bendr0id** [comment]
There are a few people hosting 300+ miners on a t2.nano AWS instance, so your server should idle with 80 miners. You're using latest master or release?

Is it possible for you to provide me with a core dump?

For a creating a coredump make sure you compiled debug version.

If you don't know howto do that, feel free to ask.

**Comment by mamkinminer** [comment]
Problem solved.
Look like system bug.
After install all OS updates all work OK.

Thank you!

**Comment by Bendr0id** [comment]
Good to hear. I've you have further problems, just let me know.
